Name,Handle,Timestamp,Verified,Content,Comments,Retweets,Likes,Analytics,Tags,Mentions,Emojis,Profile Image,Tweet Link,Tweet ID
Inside NU,@insidenu,2023-08-16T17:31:07.000Z,False,"Hagarty on playing NU last year: ""It was a good feeling. Never something I look back on now. I was trying to come here out of high school. I'm very excited for where this program's going.""",0,0,0,1K,[],[],[],https://pbs.twimg.com/profile_images/867121551665225728/Eo23-Nxa_x96.jpg,https://twitter.com/insidenu/status/1691865183050756368,tweet_id:1691865183050756368
Inside NU,@insidenu,2023-08-16T17:30:43.000Z,False,"Bryant on his connection with receivers: ""I think just getting around them a lot. We threw a lot in the summer. Whenever we're on the field and stuff happens, we're always talking to those guys. It's gotten better and better throughout camp.""",0,0,1,1.1K,[],[],[],https://pbs.twimg.com/profile_images/867121551665225728/Eo23-Nxa_x96.jpg,https://twitter.com/insidenu/status/1691865081691205920,tweet_id:1691865081691205920
Inside NU,@insidenu,2023-08-16T17:29:57.000Z,False,"More: ""The best guy's going to play.""",0,0,0,832,[],[],[],https://pbs.twimg.com/profile_images/867121551665225728/Eo23-Nxa_x96.jpg,https://twitter.com/insidenu/status/1691864888182796417,tweet_id:1691864888182796417
Inside NU,@insidenu,2023-08-16T17:29:47.000Z,False,"Bryant on the competition: ""Everyone's welcomed me with open arms. Quarterback room, I can't speak enough about how awesome they've been. Coach Jake's such a great coach.""

Called it one of the ""smartest quarterback rooms"" he's ever been around.",1,0,6,2.6K,[],[],[],https://pbs.twimg.com/profile_images/867121551665225728/Eo23-Nxa_x96.jpg,https://twitter.com/insidenu/status/1691864845543502261,tweet_id:1691864845543502261
Inside NU,@insidenu,2023-08-16T17:29:12.000Z,False,"Henning on his role for the offense: ""Anything, I'm up for it. I feel like I can affect the game in multiple ways.""

Noted his versatility of playing outside or inside.",0,0,3,1K,[],[],[],https://pbs.twimg.com/profile_images/867121551665225728/Eo23-Nxa_x96.jpg,https://twitter.com/insidenu/status/1691864698654781655,tweet_id:1691864698654781655
Inside NU,@insidenu,2023-08-16T17:27:30.000Z,False,"That concludes Braun's availability. We'll hear from Bryant, Henning and Hagarty shortly.",0,0,0,1K,[],[],[],https://pbs.twimg.com/profile_images/867121551665225728/Eo23-Nxa_x96.jpg,https://twitter.com/insidenu/status/1691864273264275916,tweet_id:1691864273264275916
Inside NU,@insidenu,2023-08-16T17:26:51.000Z,False,"On the first home game: ""I certainly hope that this community, our alumni, all those that are associated with Northwestern University, will come out and show full support for 103 young men that have worked their butts off.""

Said he's ""really confident"" that will occur.",1,1,16,5.7K,[],[],[],https://pbs.twimg.com/profile_images/867121551665225728/Eo23-Nxa_x96.jpg,https://twitter.com/insidenu/status/1691864106976899200,tweet_id:1691864106976899200
Inside NU,@insidenu,2023-08-16T17:26:03.000Z,False,"Braun on the team's reception at Rutgers: ""I don't know. We've certainly thought of it. I think some of that is speculation, which I certainly can't speak to.""

Said that the team has provided ""tools"" to handle the environment.",1,1,1,6.3K,[],[],[],https://pbs.twimg.com/profile_images/867121551665225728/Eo23-Nxa_x96.jpg,https://twitter.com/insidenu/status/1691863906187178403,tweet_id:1691863906187178403
Inside NU,@insidenu,2023-08-16T17:25:12.000Z,False,"Braun on deciding on a QB: ""At the end of the day, it'll be my decision, but I'm going to lean on Mike [Bajakian] heavily.""

Emphasized his collaborative efforts with coaches.

""A great quarterback finds a way to rally a football team.""",0,0,0,1.1K,[],[],[],https://pbs.twimg.com/profile_images/867121551665225728/Eo23-Nxa_x96.jpg,https://twitter.com/insidenu/status/1691863695591174343,tweet_id:1691863695591174343
Inside NU,@insidenu,2023-08-16T17:24:10.000Z,False,"Braun on the offensive line: ""I feel good about the depth. I feel very good about the trajectory of that group.""

Said that OL coach Kurt Anderson has worked with different combinations and positions.",0,0,4,2K,[],[],[],https://pbs.twimg.com/profile_images/867121551665225728/Eo23-Nxa_x96.jpg,https://twitter.com/insidenu/status/1691863431412937190,tweet_id:1691863431412937190
Inside NU,@insidenu,2023-08-16T17:22:35.000Z,False,"Braun on his new coaching staff: ""As each day has gone by, we've become more and more comfortable. Still have a lot to learn.""

Said he's still talked to Matt Entz at NDSU.",0,0,0,1.3K,[],[],[],https://pbs.twimg.com/profile_images/867121551665225728/Eo23-Nxa_x96.jpg,https://twitter.com/insidenu/status/1691863037060280333,tweet_id:1691863037060280333
Inside NU,@insidenu,2023-08-16T17:21:03.000Z,False,"Braun on A.J. Henning: ""His connection with both [QBs] is really impressive. He's such a great energy in the building.""

Called him an ""enormous headache"" in terms of defensive gameplanning. Noted his work lining up in the backfield and slot, and on jet sweeps.",0,0,4,1.7K,[],[],[],https://pbs.twimg.com/profile_images/867121551665225728/Eo23-Nxa_x96.jpg,https://twitter.com/insidenu/status/1691862648210551005,tweet_id:1691862648210551005
Inside NU,@insidenu,2023-08-16T17:20:14.000Z,False,"Braun: ""There's very clearly open communication lines. Those relationships have been built, and will continue to be built.""

Said he feels ""very comfortable"" communicating with athletic administration.",0,0,1,1.1K,[],[],[],https://pbs.twimg.com/profile_images/867121551665225728/Eo23-Nxa_x96.jpg,https://twitter.com/insidenu/status/1691862444421902475,tweet_id:1691862444421902475
Inside NU,@insidenu,2023-08-16T17:18:39.000Z,False,"Said that the team is ""very calculated"" about that area.",0,0,2,906,[],[],[],https://pbs.twimg.com/profile_images/867121551665225728/Eo23-Nxa_x96.jpg,https://twitter.com/insidenu/status/1691862045145133128,tweet_id:1691862045145133128
Inside NU,@insidenu,2023-08-16T17:18:25.000Z,False,"Braun on preseason traditions: ""We've had an opportunity to go through extensive education when it comes to hazing. That education will continue. We're being very mindful of making sure that we find ways to allow this team to build, and become cohesive, and have fun.""",1,0,10,4.4K,[],[],[],https://pbs.twimg.com/profile_images/867121551665225728/Eo23-Nxa_x96.jpg,https://twitter.com/insidenu/status/1691861988350062904,tweet_id:1691861988350062904
Inside NU,@insidenu,2023-08-16T17:17:01.000Z,False,"Says that he and Hagarty have shared ""wisdom"" about being fathers.",0,0,2,800,[],[],[],https://pbs.twimg.com/profile_images/867121551665225728/Eo23-Nxa_x96.jpg,https://twitter.com/insidenu/status/1691861632404648007,tweet_id:1691861632404648007
Inside NU,@insidenu,2023-08-16T17:16:38.000Z,False,"Braun said that DL Richie Hagarty has a ""really neat story"" and a ""sense of purpose.""

""He's very intentional about the way he approaches practice. He's going to bring a different energy to the room. He's going to show up ready to work in everything that he does.""",1,0,4,1.4K,[],[],[],https://pbs.twimg.com/profile_images/867121551665225728/Eo23-Nxa_x96.jpg,https://twitter.com/insidenu/status/1691861537458188390,tweet_id:1691861537458188390
Inside NU,@insidenu,2023-08-16T17:16:01.000Z,False,"Braun: ""Our focus has shifted to Rutgers. Our focus has shifted to serving these young men. The best way we can serve them right now is focusing on getting a win in New Jersey.""",0,0,6,1.3K,[],[],[],https://pbs.twimg.com/profile_images/867121551665225728/Eo23-Nxa_x96.jpg,https://twitter.com/insidenu/status/1691861381673361644,tweet_id:1691861381673361644
Inside NU,@insidenu,2023-08-16T17:15:07.000Z,False,"Stressed the depth of the group and ""rotating guys in.""

""There's a certain level of camaraderie in that room that's really special.""",0,0,1,815,[],[],[],https://pbs.twimg.com/profile_images/867121551665225728/Eo23-Nxa_x96.jpg,https://twitter.com/insidenu/status/1691861157357777009,tweet_id:1691861157357777009
Inside NU,@insidenu,2023-08-16T17:14:42.000Z,False,"Braun on the defensive line: ""Coach Smith has done an incredible job developing the young men. I see a group that has a lot of room for improvement, is not where they need to be at today. A group, Week One, that can help us win a football game.""",1,0,9,2.3K,[],[],[],https://pbs.twimg.com/profile_images/867121551665225728/Eo23-Nxa_x96.jpg,https://twitter.com/insidenu/status/1691861053133517107,tweet_id:1691861053133517107
Inside NU,@insidenu,2023-08-16T17:13:26.000Z,False,"Braun on quarterbacks: ""We're still in an open competition.""

Said he'll make a decision after Saturday's scrimmage.

Noted that Brendan Sullivan can make an impact with his legs.

""Both are doing a great job of competing.""",0,0,5,1.8K,[],[],[],https://pbs.twimg.com/profile_images/867121551665225728/Eo23-Nxa_x96.jpg,https://twitter.com/insidenu/status/1691860732353122716,tweet_id:1691860732353122716
Inside NU,@insidenu,2023-08-16T17:12:34.000Z,False,"Braun: ""This team has done a great job of showing a great deal of resolve.""",0,0,1,983,[],[],[],https://pbs.twimg.com/profile_images/867121551665225728/Eo23-Nxa_x96.jpg,https://twitter.com/insidenu/status/1691860515620814945,tweet_id:1691860515620814945
Inside NU,@insidenu,2023-08-16T17:12:22.000Z,False,"Braun said there's a ""lot of excitement"" about the upcoming season.

Added that he and the operations staff ventured to Ryan Field for the first time yesterday to determine how they'll operate on gamedays.",0,0,0,1.1K,[],[],[],https://pbs.twimg.com/profile_images/867121551665225728/Eo23-Nxa_x96.jpg,https://twitter.com/insidenu/status/1691860463770890557,tweet_id:1691860463770890557
Inside NU,@insidenu,2023-08-16T17:11:35.000Z,False,"David Braun in his opening statement: ""It's been fun to get into some of that prep. Have a scrimmage this coming Saturday. Two-deeps are starting to work themselves out.""

Said the Rutgers game is ""quickly on the horizon.""",0,0,4,1.4K,[],[],[],https://pbs.twimg.com/profile_images/867121551665225728/Eo23-Nxa_x96.jpg,https://twitter.com/insidenu/status/1691860268777697775,tweet_id:1691860268777697775
Inside NU,@insidenu,2023-08-16T16:45:34.000Z,False,"Here in the Walter Athletics Center Team Auditorium, where we'll hear from Northwestern HC David Braun, QB Ben Bryant, WR A.J. Henning and DL Richie Hagarty in around 20 minutes. Stay tuned for updates!",0,2,10,4.1K,[],[],[],https://pbs.twimg.com/profile_images/867121551665225728/Eo23-Nxa_x96.jpg,https://twitter.com/insidenu/status/1691853720294768774,tweet_id:1691853720294768774
Inside NU,@insidenu,2023-08-15T21:02:30.000Z,False,"The last time Northwestern won on American soil was in October 2021 against Rutgers.

Can the ‘Cats end their 687-day streak against the Scarlet Knights on opening day?",0,0,4,2.2K,[],[],[],https://pbs.twimg.com/profile_images/867121551665225728/Eo23-Nxa_x96.jpg,https://twitter.com/insidenu/status/1691555992469749949,tweet_id:1691555992469749949
Inside NU,@insidenu,2023-08-15T18:49:19.000Z,False,"Though David Braun enters 2023 with uncertainty about his future as Northwestern’s head coach, these former interim leaders extended their success over years.",1,1,8,2.7K,[],[],[],https://pbs.twimg.com/profile_images/867121551665225728/Eo23-Nxa_x96.jpg,https://twitter.com/insidenu/status/1691522473072730112,tweet_id:1691522473072730112
Inside NU,@insidenu,2023-08-15T18:46:25.000Z,False,"Think soccer staple, think Ella Hase. The senior is back for more in 2023.",0,0,3,1.7K,[],[],[],https://pbs.twimg.com/profile_images/867121551665225728/Eo23-Nxa_x96.jpg,https://twitter.com/insidenu/status/1691521744517877761,tweet_id:1691521744517877761
Inside NU,@insidenu,2023-08-14T17:05:54.000Z,False,"The Wildcats will have their best chance of victory early in the season, while matchups with formidable teams loom late in the year.",0,0,5,3.3K,[],[],[],https://pbs.twimg.com/profile_images/867121551665225728/Eo23-Nxa_x96.jpg,https://twitter.com/insidenu/status/1691134061606064133,tweet_id:1691134061606064133
Inside NU,@insidenu,2023-08-14T17:04:00.000Z,False,Northwestern is going to look for all the help it can get from its special teams this year.,0,0,5,2.3K,[],[],[],https://pbs.twimg.com/profile_images/867121551665225728/Eo23-Nxa_x96.jpg,https://twitter.com/insidenu/status/1691133582301974541,tweet_id:1691133582301974541
Inside NU,@insidenu,2023-08-13T20:27:39.000Z,False,Annabel Skubisz may just be one of the best goalkeepers in all of college field hockey.,1,1,16,3.5K,[],[],[],https://pbs.twimg.com/profile_images/867121551665225728/Eo23-Nxa_x96.jpg,https://twitter.com/insidenu/status/1690822443789598720,tweet_id:1690822443789598720
Inside NU,@insidenu,2023-08-13T17:40:26.000Z,False,"It’s a new-look group in the defensive backfield, but it’s also one of the more experienced ones on the team.",0,2,8,3.4K,[],[],[],https://pbs.twimg.com/profile_images/867121551665225728/Eo23-Nxa_x96.jpg,https://twitter.com/insidenu/status/1690780363667234816,tweet_id:1690780363667234816
Inside NU,@insidenu,2023-08-13T16:12:53.000Z,False,"The transfer portal has shaken up the Northwestern depth chart. As the season opener nears, which Wildcat players need to assume bigger roles for the team to improve in 2023?",0,1,3,2.8K,[],[],[],https://pbs.twimg.com/profile_images/867121551665225728/Eo23-Nxa_x96.jpg,https://twitter.com/insidenu/status/1690758332229816320,tweet_id:1690758332229816320
Inside NU,@insidenu,2023-08-13T15:30:12.000Z,False,"A First Team All-Big Ten selection last year, Meg Boade will be integral to the Wildcats’ hopes of making consecutive NCAA Tournaments.",0,1,5,2.5K,[],[],[],https://pbs.twimg.com/profile_images/867121551665225728/Eo23-Nxa_x96.jpg,https://twitter.com/insidenu/status/1690747591061843968,tweet_id:1690747591061843968
Inside NU,@insidenu,2023-08-12T19:16:51.000Z,False,"Northwestern volleyball had to reload its roster this offseason, but do the ‘Cats have enough offensive firepower to compete in the Big Ten?",0,0,2,2.3K,[],[],[],https://pbs.twimg.com/profile_images/867121551665225728/Eo23-Nxa_x96.jpg,https://twitter.com/insidenu/status/1690442241074962432,tweet_id:1690442241074962432
Inside NU,@insidenu,2023-08-12T17:41:39.000Z,False,"With the entire starting trio returning to Evanston, Northwestern’s linebackers bring experience to guide a first-year defense.",0,3,14,3.3K,[],[],[],https://pbs.twimg.com/profile_images/867121551665225728/Eo23-Nxa_x96.jpg,https://twitter.com/insidenu/status/1690418283348975619,tweet_id:1690418283348975619
Inside NU,@insidenu,2023-08-11T17:38:02.000Z,False,"Without Adetomiwa Adebawore and after adding several transfers, Northwestern’s defensive line will undergo adjustments in 2023.",0,2,4,3.1K,[],[],[],https://pbs.twimg.com/profile_images/867121551665225728/Eo23-Nxa_x96.jpg,https://twitter.com/insidenu/status/1690054982148464652,tweet_id:1690054982148464652
Inside NU,@insidenu,2023-08-11T17:28:18.000Z,False,"Now a senior, Ingrid Falls still has goals to score and assists to kick.",0,0,1,1.8K,[],[],[],https://pbs.twimg.com/profile_images/867121551665225728/Eo23-Nxa_x96.jpg,https://twitter.com/insidenu/status/1690052532645568515,tweet_id:1690052532645568515
Inside NU,@insidenu,2023-08-11T15:02:08.000Z,False,"According to multiple sources that Inside NU spoke to, including current and former players, Northwestern baseball has decided not to hire Brian Anderson as head coach.

Players were left to share news among themselves — and don’t trust the hiring process.",14,24,55,35K,[],[],[],https://pbs.twimg.com/profile_images/867121551665225728/Eo23-Nxa_x96.jpg,https://twitter.com/insidenu/status/1690015750474379265,tweet_id:1690015750474379265
Inside NU,@insidenu,2023-08-10T17:34:34.000Z,True,JJTBC calls it a career after five great years in the NFL. Congrats to one of the best to ever do it in purple and white!,2,2,108,19K,[],[],[],https://pbs.twimg.com/profile_images/867121551665225728/Eo23-Nxa_x96.jpg,https://twitter.com/insidenu/status/1689691724753326080,tweet_id:1689691724753326080
Inside NU,@insidenu,2023-08-10T17:21:10.000Z,False,"Northwestern football’s first open practice provided a chance to hear from David Braun, as well as three veteran players. On the field, players partook in drills — and coaches made statements with their clothing choices, sparking more negative headlines.",2,1,4,4.1K,[],[],[],https://pbs.twimg.com/profile_images/867121551665225728/Eo23-Nxa_x96.jpg,https://twitter.com/insidenu/status/1689688349676564497,tweet_id:1689688349676564497
Inside NU,@insidenu,2023-08-10T17:05:04.000Z,False,"Men’s soccer kicks off its exhibition slate tomorrow, so it’s time to dive into what will help the ‘Cats climb up the ranks of the Big Ten.",0,0,1,1.9K,[],[],[],https://pbs.twimg.com/profile_images/867121551665225728/Eo23-Nxa_x96.jpg,https://twitter.com/insidenu/status/1689684299547656192,tweet_id:1689684299547656192
Inside NU,@insidenu,2023-08-09T19:23:23.000Z,False,"It’s no secret that Northwestern’s success in 2022 had a lot to do with its defense. How will Nicole Doucette, a starter from last season’s bunch, continue to figure into the mix in 2023?",0,0,5,2.1K,[],[],[],https://pbs.twimg.com/profile_images/867121551665225728/Eo23-Nxa_x96.jpg,https://twitter.com/insidenu/status/1689356722362556417,tweet_id:1689356722362556417
Inside NU,@insidenu,2023-08-09T18:09:13.000Z,False,That ends today's media availability. The next is scheduled for Aug. 16.,0,0,1,2K,[],[],[],https://pbs.twimg.com/profile_images/867121551665225728/Eo23-Nxa_x96.jpg,https://twitter.com/insidenu/status/1689338056174710784,tweet_id:1689338056174710784
Inside NU,@insidenu,2023-08-09T18:08:59.000Z,False,"Heard on attention from other programs: ""We mainly focused on ourselves. I just focused on being here and doing what I have to do.""",0,0,2,1.9K,[],[],[],https://pbs.twimg.com/profile_images/867121551665225728/Eo23-Nxa_x96.jpg,https://twitter.com/insidenu/status/1689337995147538432,tweet_id:1689337995147538432
Inside NU,@insidenu,2023-08-09T18:08:32.000Z,False,"Heard, when asked if hazing has a place in sports: ""I don't think we want to comment on that.""",12,22,16,42K,[],[],[],https://pbs.twimg.com/profile_images/867121551665225728/Eo23-Nxa_x96.jpg,https://twitter.com/insidenu/status/1689337883096690688,tweet_id:1689337883096690688
Inside NU,@insidenu,2023-08-09T18:08:17.000Z,False,"Heard on players who stayed: ""I think it just shows that what we have here is of value. The players that stayed, they wanted to be here.""

All three said they didn't consider transferring.",3,0,16,4.3K,[],[],[],https://pbs.twimg.com/profile_images/867121551665225728/Eo23-Nxa_x96.jpg,https://twitter.com/insidenu/status/1689337818701582336,tweet_id:1689337818701582336
Inside NU,@insidenu,2023-08-09T18:07:44.000Z,False,"Kirtz on receiver transfer adds: ""We've definitely helped each other out on the field.""

Called A.J. Henning ""fast and quick."" Noted that Cam Johnson's ""played a lot of football.""

""It's been great having them in the room.""",0,0,7,2K,[],[],[],https://pbs.twimg.com/profile_images/867121551665225728/Eo23-Nxa_x96.jpg,https://twitter.com/insidenu/status/1689337684404191233,tweet_id:1689337684404191233
Inside NU,@insidenu,2023-08-09T18:06:34.000Z,False,"Gallagher on camp differences: ""I honestly think that Coach Braun and the whole staff has done a good job keeping it as normal as they can. Keeping that as close to what we've been used to.""",1,0,9,2.4K,[],[],[],https://pbs.twimg.com/profile_images/867121551665225728/Eo23-Nxa_x96.jpg,https://twitter.com/insidenu/status/1689337389993353216,tweet_id:1689337389993353216
Inside NU,@insidenu,2023-08-09T18:05:46.000Z,False,"Kirtz on what he knew about Braun: ""I definitely did not know much about Coach Braun, just because he was a defensively guy. He always made it clear that he wanted to get to know the entire team. He would be walking around, just saying 'What's up' to the guys.""",1,0,3,2.2K,[],[],[],https://pbs.twimg.com/profile_images/867121551665225728/Eo23-Nxa_x96.jpg,https://twitter.com/insidenu/status/1689337189207838722,tweet_id:1689337189207838722
Inside NU,@insidenu,2023-08-09T18:04:52.000Z,False,"Kirtz on Jack Fitzgerald: ""Jack, he's been around. He works as an assistant now. We've really just been there for him.""",1,0,15,4.5K,[],[],[],https://pbs.twimg.com/profile_images/867121551665225728/Eo23-Nxa_x96.jpg,https://twitter.com/insidenu/status/1689336960941219840,tweet_id:1689336960941219840
Inside NU,@insidenu,2023-08-09T18:04:32.000Z,False,"Heard said that the team hasn't been focused on what things ""outside of the people have.""

""They don't know what's going on. They can have their opinion.""",0,0,0,1.5K,[],[],[],https://pbs.twimg.com/profile_images/867121551665225728/Eo23-Nxa_x96.jpg,https://twitter.com/insidenu/status/1689336878539964417,tweet_id:1689336878539964417
Inside NU,@insidenu,2023-08-09T18:04:09.000Z,False,"Gallagher said that these circumstances emphasized ""leaning on the people around you.""",2,0,5,2.2K,[],[],[],https://pbs.twimg.com/profile_images/867121551665225728/Eo23-Nxa_x96.jpg,https://twitter.com/insidenu/status/1689336780506501121,tweet_id:1689336780506501121
Inside NU,@insidenu,2023-08-09T18:03:18.000Z,False,"Gallagher said the team was ""devastated"" after Pat Fitzgerald fired.

""We loved Coach Fitz. We have full belief in Coach Braun. He's been unbelievable, and has really just shown us how much he cares about us.""",0,1,6,2.1K,[],[],[],https://pbs.twimg.com/profile_images/867121551665225728/Eo23-Nxa_x96.jpg,https://twitter.com/insidenu/status/1689336567418982401,tweet_id:1689336567418982401
Inside NU,@insidenu,2023-08-09T18:02:47.000Z,False,"Gallagher: ""This place is great. You get the best of both worlds when you come to Northwestern.""

Stressed academics and Big Ten football.",0,0,8,1.8K,[],[],[],https://pbs.twimg.com/profile_images/867121551665225728/Eo23-Nxa_x96.jpg,https://twitter.com/insidenu/status/1689336435462070272,tweet_id:1689336435462070272
Inside NU,@insidenu,2023-08-09T18:02:21.000Z,False,"Heard: ""We've always had people of high character. For the recruits coming in, we'd just say, 'Be ready to work. Apply yourself. Take the opportunity for what it is.'""",0,0,8,2.4K,[],[],[],https://pbs.twimg.com/profile_images/867121551665225728/Eo23-Nxa_x96.jpg,https://twitter.com/insidenu/status/1689336326145949696,tweet_id:1689336326145949696
Inside NU,@insidenu,2023-08-09T18:01:26.000Z,False,"Heard: ""I think we've just gone a great job of moving forward. Looking forward to all the opportunities that we have to go out there on the field.""",0,0,3,1.5K,[],[],[],https://pbs.twimg.com/profile_images/867121551665225728/Eo23-Nxa_x96.jpg,https://twitter.com/insidenu/status/1689336096943955968,tweet_id:1689336096943955968
Inside NU,@insidenu,2023-08-09T18:00:52.000Z,False,"Gallagher: ""What I can tell you is right now, we have a great culture in our locker room. Guys are really sticking together through this. Just leaning on our relationships. Having that carryover on the field, too.""",0,0,11,2.2K,[],[],[],https://pbs.twimg.com/profile_images/867121551665225728/Eo23-Nxa_x96.jpg,https://twitter.com/insidenu/status/1689335954153046016,tweet_id:1689335954153046016
Inside NU,@insidenu,2023-08-09T18:00:18.000Z,False,"Gallagher on Braun's new defensive scheme: ""There's definitely similarities and differences [to the past]. We're really excited to keep mastering that during training camp.""

Heard: ""I think he's gone a great job of trying to create more opportunities for the players.""",0,0,0,1.3K,[],[],[],https://pbs.twimg.com/profile_images/867121551665225728/Eo23-Nxa_x96.jpg,https://twitter.com/insidenu/status/1689335811169193984,tweet_id:1689335811169193984
Inside NU,@insidenu,2023-08-09T17:59:21.000Z,False,"Gallagher said it's been a ""fresh of fresh air"" to get back on the field.

""Just making sure our focus is on Rutgers.""",0,0,5,1.6K,[],[],[],https://pbs.twimg.com/profile_images/867121551665225728/Eo23-Nxa_x96.jpg,https://twitter.com/insidenu/status/1689335572437897216,tweet_id:1689335572437897216
Inside NU,@insidenu,2023-08-09T17:58:48.000Z,False,"Heard: ""We've always had great leaders in the program. It's just our time to step up.""",0,0,3,1.3K,[],[],[],https://pbs.twimg.com/profile_images/867121551665225728/Eo23-Nxa_x96.jpg,https://twitter.com/insidenu/status/1689335434441113600,tweet_id:1689335434441113600
Inside NU,@insidenu,2023-08-09T17:58:10.000Z,False,"Kirtz: ""Coach Braun, he's been preaching that we should stick together. The shirts are really just a reminder to stick together.""

Gallagher: ""The only people we need are the people in this facility.""",5,9,28,27K,[],[],[],https://pbs.twimg.com/profile_images/867121551665225728/Eo23-Nxa_x96.jpg,https://twitter.com/insidenu/status/1689335274977800192,tweet_id:1689335274977800192
Inside NU,@insidenu,2023-08-09T17:57:24.000Z,False,"Gallagher: ""We're not here today to talk about any hazing allegations.""",0,3,5,26K,[],[],[],https://pbs.twimg.com/profile_images/867121551665225728/Eo23-Nxa_x96.jpg,https://twitter.com/insidenu/status/1689335082547363845,tweet_id:1689335082547363845
Inside NU,@insidenu,2023-08-09T17:57:03.000Z,False,"Kirtz: ""Our main focus is to win games, and stick together. That's been a big aspect of what we're trying to do as a team.""",0,0,4,1K,[],[],[],https://pbs.twimg.com/profile_images/867121551665225728/Eo23-Nxa_x96.jpg,https://twitter.com/insidenu/status/1689334993493864448,tweet_id:1689334993493864448
