Name,Handle,Timestamp,Verified,Content,Comments,Retweets,Likes,Analytics,Tags,Mentions,Emojis,Profile Image,Tweet Link,Tweet ID
Inside NU,@insidenu,2023-09-03T16:29:10.000Z,False,Bryant to Henning for 26 in the face of pressure. We used to pray for times like this.,0,0,1,841,[],[],[],https://pbs.twimg.com/profile_images/867121551665225728/Eo23-Nxa_x96.jpg,https://twitter.com/insidenu/status/1698372575141724569,tweet_id:1698372575141724569
Inside NU,@insidenu,2023-09-03T16:28:27.000Z,False,Bryant completes his first pass as a Wildcat to Cam Porter for six. The offense is up-tempo.,0,0,1,806,[],[],[],https://pbs.twimg.com/profile_images/867121551665225728/Eo23-Nxa_x96.jpg,https://twitter.com/insidenu/status/1698372394543423561,tweet_id:1698372394543423561
Inside NU,@insidenu,2023-09-03T16:27:12.000Z,False,"No A.J. Henning on the kick return, from what we see. Azema is back to receive.",0,0,0,737,[],[],[],https://pbs.twimg.com/profile_images/867121551665225728/Eo23-Nxa_x96.jpg,https://twitter.com/insidenu/status/1698372079605645706,tweet_id:1698372079605645706
Inside NU,@insidenu,2023-09-03T16:24:08.000Z,False,"Strong hauls it in, and it's a touchdown for Rutgers. That's a 16-play, 75 yard drive with four 3rd or 4th down conversions.",0,0,2,994,[],[],[],https://pbs.twimg.com/profile_images/867121551665225728/Eo23-Nxa_x96.jpg,https://twitter.com/insidenu/status/1698371305098150379,tweet_id:1698371305098150379
Inside NU,@insidenu,2023-09-03T16:22:40.000Z,False,"From the replay, it appears that Strong came down with it. A beautiful catch if this gets reversed, with Hollis and Coco Azema in coverage.",0,0,2,1.6K,[],[],[],https://pbs.twimg.com/profile_images/867121551665225728/Eo23-Nxa_x96.jpg,https://twitter.com/insidenu/status/1698370938134290615,tweet_id:1698370938134290615
Inside NU,@insidenu,2023-09-03T16:21:57.000Z,False,"Wimsatt with a touch pass to the back corner of the end zone to Ian Strong. It's ruled incomplete, but this is getting reviewed.",0,1,0,2.3K,[],[],[],https://pbs.twimg.com/profile_images/867121551665225728/Eo23-Nxa_x96.jpg,https://twitter.com/insidenu/status/1698370758248927709,tweet_id:1698370758248927709
Inside NU,@insidenu,2023-09-03T16:20:16.000Z,False,Yet another third down conversion for Rutgers.,0,0,5,2.1K,[],[],[],https://pbs.twimg.com/profile_images/867121551665225728/Eo23-Nxa_x96.jpg,https://twitter.com/insidenu/status/1698370335777706418,tweet_id:1698370335777706418
Inside NU,@insidenu,2023-09-03T16:18:48.000Z,False,Yet another 4th down conversion. Wimsatt rolls out and calmly finds the receiver for a first. Scarlet Knights at the Northwestern 22 now.,0,0,0,845,[],[],[],https://pbs.twimg.com/profile_images/867121551665225728/Eo23-Nxa_x96.jpg,https://twitter.com/insidenu/status/1698369964091040122,tweet_id:1698369964091040122
Inside NU,@insidenu,2023-09-03T16:17:04.000Z,False,"Devin Turner, who has started at safety and hasn't come off the field yet, with a really nice run stuff to bring up yet another third down.",0,0,0,733,[],[],[],https://pbs.twimg.com/profile_images/867121551665225728/Eo23-Nxa_x96.jpg,https://twitter.com/insidenu/status/1698369530639106311,tweet_id:1698369530639106311
Inside NU,@insidenu,2023-09-03T16:15:54.000Z,False,"Kyle Monangai bulldozes his way into NU territory for eight, moving the chains on the fourth down attempt.",0,0,0,755,[],[],[],https://pbs.twimg.com/profile_images/867121551665225728/Eo23-Nxa_x96.jpg,https://twitter.com/insidenu/status/1698369233439133705,tweet_id:1698369233439133705
Inside NU,@insidenu,2023-09-03T16:15:15.000Z,False,"Wimsatt picks up nine with a button hook, setting up a fourth and short.",0,0,0,734,[],[],[],https://pbs.twimg.com/profile_images/867121551665225728/Eo23-Nxa_x96.jpg,https://twitter.com/insidenu/status/1698369073640243604,tweet_id:1698369073640243604
Inside NU,@insidenu,2023-09-03T16:13:33.000Z,False,Garnett Hollis with a PBU on the first down pass. Really physical from him there.,0,0,0,719,[],[],[],https://pbs.twimg.com/profile_images/867121551665225728/Eo23-Nxa_x96.jpg,https://twitter.com/insidenu/status/1698368643808018497,tweet_id:1698368643808018497
Inside NU,@insidenu,2023-09-03T16:12:48.000Z,False,"Sean McLaughlin with a NICE run stuff on second down, but Monangai picks up the first up the middle.",0,0,0,902,[],[],[],https://pbs.twimg.com/profile_images/867121551665225728/Eo23-Nxa_x96.jpg,https://twitter.com/insidenu/status/1698368455802503399,tweet_id:1698368455802503399
Inside NU,@insidenu,2023-09-03T16:11:42.000Z,False,"On the first play from scrimmage, Wimsatt picks up eight with a pass on a bootleg.",0,0,0,616,[],[],[],https://pbs.twimg.com/profile_images/867121551665225728/Eo23-Nxa_x96.jpg,https://twitter.com/insidenu/status/1698368178554843448,tweet_id:1698368178554843448
Inside NU,@insidenu,2023-09-03T16:10:22.000Z,False,"Touchback on the kick, and we're off.",0,0,1,706,[],[],[],https://pbs.twimg.com/profile_images/867121551665225728/Eo23-Nxa_x96.jpg,https://twitter.com/insidenu/status/1698367842272317911,tweet_id:1698367842272317911
Inside NU,@insidenu,2023-09-03T16:09:12.000Z,False,"Northwestern wins the toss and will defer. Rutgers gets the ball to start, and kickoff is just about a minute away here.",0,0,2,1.6K,[],[],[],https://pbs.twimg.com/profile_images/867121551665225728/Eo23-Nxa_x96.jpg,https://twitter.com/insidenu/status/1698367549958651980,tweet_id:1698367549958651980
Inside NU,@insidenu,2023-09-03T15:46:24.000Z,False,CBS!,0,0,0,43,[],[],[],https://pbs.twimg.com/profile_images/867121551665225728/Eo23-Nxa_x96.jpg,https://twitter.com/insidenu/status/1698361812150895103,tweet_id:1698361812150895103
Inside NU,@insidenu,2023-09-03T15:22:56.000Z,False,The INU crew is moderately split on how this afternoon will go.,1,0,1,1.1K,[],[],[],https://pbs.twimg.com/profile_images/867121551665225728/Eo23-Nxa_x96.jpg,https://twitter.com/insidenu/status/1698355904133910635,tweet_id:1698355904133910635
Inside NU,@insidenu,2023-09-03T15:16:44.000Z,False,It’s that time.,0,0,1,985,[],[],[],https://pbs.twimg.com/profile_images/867121551665225728/Eo23-Nxa_x96.jpg,https://twitter.com/insidenu/status/1698354343760502865,tweet_id:1698354343760502865
Inside NU,@insidenu,2023-09-03T15:05:43.000Z,False,We are live from SHI Stadium in Piscataway. The David Braun era kicks off in just about an hour. Stay tuned for the tweets and coverage here!,0,0,20,2.5K,[],[],[],https://pbs.twimg.com/profile_images/867121551665225728/Eo23-Nxa_x96.jpg,https://twitter.com/insidenu/status/1698351573502488714,tweet_id:1698351573502488714
Inside NU,@insidenu,2023-09-03T13:33:39.000Z,False,"There is a new signal caller under center for Northwestern. Sixth-year Ben Bryant will be the ‘Cats’ 2023 starting quarterback, according to ESPN’s .",1,4,20,3.3K,[],['@PeteThamel'],[],https://pbs.twimg.com/profile_images/867121551665225728/Eo23-Nxa_x96.jpg,https://twitter.com/insidenu/status/1698328403923853451,tweet_id:1698328403923853451
Inside NU,@insidenu,2023-09-03T13:22:37.000Z,True,"Well, there we have it. Bryant will start the opener, making it Northwestern’s sixth straight year of having a different Week 1 starter at QB.",0,3,12,3K,[],[],[],https://pbs.twimg.com/profile_images/867121551665225728/Eo23-Nxa_x96.jpg,https://twitter.com/insidenu/status/1698325624954192141,tweet_id:1698325624954192141
Inside NU,@insidenu,2023-09-02T01:34:07.000Z,False,"Hailey Rhatigan  Peyton Halsey

Game-ending goals against Boston    College",0,1,32,8.2K,[],[],['\\U0001f91d'],https://pbs.twimg.com/profile_images/867121551665225728/Eo23-Nxa_x96.jpg,https://twitter.com/insidenu/status/1697784939058495894,tweet_id:1697784939058495894
Inside NU,@insidenu,2023-09-01T20:36:04.000Z,False,"Just like Northwestern football, Pound the Talk is so back.

Hosts  and  are joined by  to analyze the Wildcats’ position groups, give their X-factors for Sunday’s matchup with Rutgers and predict who will win.",0,4,12,5.3K,[],"['@Bradley_Locker', '@DavidGoldINU', '@JMozarsky']",[],https://pbs.twimg.com/profile_images/867121551665225728/Eo23-Nxa_x96.jpg,https://twitter.com/insidenu/status/1697709934052339729,tweet_id:1697709934052339729
Inside NU,@insidenu,2023-09-01T18:12:41.000Z,False,"Before Northwestern ventures to Piscataway, here’s an in-depth look at the Rutgers Scarlet Knights on both sides of the ball.",0,0,0,1.8K,[],[],[],https://pbs.twimg.com/profile_images/867121551665225728/Eo23-Nxa_x96.jpg,https://twitter.com/insidenu/status/1697673849251266929,tweet_id:1697673849251266929
Inside NU,@insidenu,2023-09-01T18:10:11.000Z,False,"“Being the record holder of an impressive feat will get you recognized by many. Being the record holder of an infamous one will get you recognized by more,” writes .

Can Northwestern end its 23-month American drought on Sunday?",0,1,2,2.1K,[],['@byjohnf'],[],https://pbs.twimg.com/profile_images/867121551665225728/Eo23-Nxa_x96.jpg,https://twitter.com/insidenu/status/1697673220738965667,tweet_id:1697673220738965667
Inside NU,@insidenu,2023-08-31T20:14:52.000Z,False,"After two losses out in Hawaii to open the season last weekend, Northwestern pulled off a top-15 upset thanks to its depth.",1,0,8,2.6K,[],[],[],https://pbs.twimg.com/profile_images/867121551665225728/Eo23-Nxa_x96.jpg,https://twitter.com/insidenu/status/1697342209937334656,tweet_id:1697342209937334656
Inside NU,@insidenu,2023-08-31T17:28:56.000Z,False,"If Northwestern comes out on top in Piscataway, its play from its quarterback and secondary will likely pave the way.",0,0,5,2.3K,[],[],[],https://pbs.twimg.com/profile_images/867121551665225728/Eo23-Nxa_x96.jpg,https://twitter.com/insidenu/status/1697300449282359507,tweet_id:1697300449282359507
Inside NU,@insidenu,2023-08-31T16:04:35.000Z,False,Things can only go up.,0,1,5,3.7K,[],[],[],https://pbs.twimg.com/profile_images/867121551665225728/Eo23-Nxa_x96.jpg,https://twitter.com/insidenu/status/1697279222207635617,tweet_id:1697279222207635617
Inside NU,@insidenu,2023-08-30T17:35:45.000Z,False,"“It is a new era for the Wildcats. It is one that no one expected, but it is the situation at hand. Normally, a new era brings hope for a brighter future, but right now, there is a dark cloud surrounding NUFB,” writes .",0,2,6,2.3K,[],['@davidgoldINU'],[],https://pbs.twimg.com/profile_images/867121551665225728/Eo23-Nxa_x96.jpg,https://twitter.com/insidenu/status/1696939779470852126,tweet_id:1696939779470852126
Inside NU,@insidenu,2023-08-30T17:35:17.000Z,True,"Northwestern has released its five captains, with Gallagher earning the honor for a second straight year.",2,1,28,9K,[],[],[],https://pbs.twimg.com/profile_images/867121551665225728/Eo23-Nxa_x96.jpg,https://twitter.com/insidenu/status/1696939662458138752,tweet_id:1696939662458138752
Inside NU,@insidenu,2023-08-30T17:25:39.000Z,False,"With Northwestern set to kick off in a few days, what constitutes a successful season has nothing to do with the ‘Cats’ record.",1,0,9,2.3K,[],[],[],https://pbs.twimg.com/profile_images/867121551665225728/Eo23-Nxa_x96.jpg,https://twitter.com/insidenu/status/1696937235466068174,tweet_id:1696937235466068174
Inside NU,@insidenu,2023-08-30T17:24:00.000Z,False,Northwestern Men’s Soccer is off to its best start in a decade. takes a look at how the ‘Cats did it.http://sbnation.com/e/23613917,0,0,9,2.1K,[],['@InvrrtedFB'],[],https://pbs.twimg.com/profile_images/867121551665225728/Eo23-Nxa_x96.jpg,https://twitter.com/insidenu/status/1696936822331322444,tweet_id:1696936822331322444
Inside NU,@insidenu,2023-08-30T16:27:40.000Z,False,"Despite immense offensive pressure from the ‘Cats in their season opener, they came up just short in a top-10 clash against Louisville on Sunday.",0,1,3,2.1K,[],[],[],https://pbs.twimg.com/profile_images/867121551665225728/Eo23-Nxa_x96.jpg,https://twitter.com/insidenu/status/1696922645437071562,tweet_id:1696922645437071562
Inside NU,@insidenu,2023-08-29T18:01:32.000Z,True,THE KING IS BACK,0,7,70,12K,[],[],[],https://pbs.twimg.com/profile_images/867121551665225728/Eo23-Nxa_x96.jpg,https://twitter.com/insidenu/status/1696583880378139034,tweet_id:1696583880378139034
Inside NU,@insidenu,2023-08-29T17:48:17.000Z,False,"Before his first ever game as a head coach, hear from David Braun about preparing for the Scarlet Knights, deciding on a starting quarterback and more.",0,2,3,2.4K,[],[],[],https://pbs.twimg.com/profile_images/867121551665225728/Eo23-Nxa_x96.jpg,https://twitter.com/insidenu/status/1696580543666655496,tweet_id:1696580543666655496
Inside NU,@insidenu,2023-08-29T16:19:37.000Z,False,"From coaching battles to receiver-corner duels, Week One will have it all.https://insidenu.com/2023/8/29/23850505/three-matchups-to-watch-against-rutgers…",0,0,2,1.7K,[],[],[],https://pbs.twimg.com/profile_images/867121551665225728/Eo23-Nxa_x96.jpg,https://twitter.com/insidenu/status/1696558230556512272,tweet_id:1696558230556512272
Inside NU,@insidenu,2023-08-29T15:50:26.000Z,False,Game-winning goals and some clutch assists...what more could you ask for?,0,2,6,1.7K,[],[],[],https://pbs.twimg.com/profile_images/867121551665225728/Eo23-Nxa_x96.jpg,https://twitter.com/insidenu/status/1696550887882211480,tweet_id:1696550887882211480
Inside NU,@insidenu,2023-08-29T15:25:48.000Z,False,"In Week 2, it felt like once the goals started flowing, they couldn’t stop.",1,2,12,4.5K,[],[],[],https://pbs.twimg.com/profile_images/867121551665225728/Eo23-Nxa_x96.jpg,https://twitter.com/insidenu/status/1696544685827707335,tweet_id:1696544685827707335
Inside NU,@insidenu,2023-08-28T17:32:16.000Z,False,"That’s all for today’s presser, players will begin speaking to the media next week.

The next time we hear from David Braun, it’ll be in Piscataway.",2,0,3,2K,[],[],[],https://pbs.twimg.com/profile_images/867121551665225728/Eo23-Nxa_x96.jpg,https://twitter.com/insidenu/status/1696214125297188895,tweet_id:1696214125297188895
Inside NU,@insidenu,2023-08-28T17:30:42.000Z,False,"Braun on whether Fitz has helped him with advising through this process: “I’m focused on running this program, and running this program [with] the people that are in this building day-in and day-out.”",3,0,13,4.9K,[],[],[],https://pbs.twimg.com/profile_images/867121551665225728/Eo23-Nxa_x96.jpg,https://twitter.com/insidenu/status/1696213733490540686,tweet_id:1696213733490540686
Inside NU,@insidenu,2023-08-28T17:27:21.000Z,False,"Braun says several Big Ten coaches have spoken to him, either in person at Big Ten Media Days or through text and on the phone, have reached out to him.

Notes Greg Schiano of Rutgers as one that he met at Media Days.",0,0,6,2.1K,[],[],[],https://pbs.twimg.com/profile_images/867121551665225728/Eo23-Nxa_x96.jpg,https://twitter.com/insidenu/status/1696212890577998299,tweet_id:1696212890577998299
Inside NU,@insidenu,2023-08-28T17:23:13.000Z,False,Braun on the biggest thing that will motivate the team to wins this year: “Brotherhood.”,0,1,18,4.4K,[],[],[],https://pbs.twimg.com/profile_images/867121551665225728/Eo23-Nxa_x96.jpg,https://twitter.com/insidenu/status/1696211849258189073,tweet_id:1696211849258189073
Inside NU,@insidenu,2023-08-28T17:22:40.000Z,False,"Braun says it was a difficult decision to choose the starting quarterback, but is confident in the depth of the room.

Really emphasizes how much the team needs a “starting quarterback” rather than switching between guys early.",0,0,8,2.5K,[],[],[],https://pbs.twimg.com/profile_images/867121551665225728/Eo23-Nxa_x96.jpg,https://twitter.com/insidenu/status/1696211710430835180,tweet_id:1696211710430835180
Inside NU,@insidenu,2023-08-28T17:16:19.000Z,False,"Braun: “I am extremely confident in my ability to lead, to inspire, to meet people where they’re at, to pull people together for a common purpose.”

“I know I’m up to the challenge, but I’m up to the challenge because of the great people around me.”",0,0,5,1.9K,[],[],[],https://pbs.twimg.com/profile_images/867121551665225728/Eo23-Nxa_x96.jpg,https://twitter.com/insidenu/status/1696210113705480275,tweet_id:1696210113705480275
Inside NU,@insidenu,2023-08-28T17:13:40.000Z,False,Braun: “They’re ready to compete. You can feel that in the building.”,0,0,6,1.8K,[],[],[],https://pbs.twimg.com/profile_images/867121551665225728/Eo23-Nxa_x96.jpg,https://twitter.com/insidenu/status/1696209444294558180,tweet_id:1696209444294558180
Inside NU,@insidenu,2023-08-28T17:13:16.000Z,False,Braun: “There’s no better way to create value on an NFL team early on than to show your value on special teams.”,0,0,5,1.6K,[],[],[],https://pbs.twimg.com/profile_images/867121551665225728/Eo23-Nxa_x96.jpg,https://twitter.com/insidenu/status/1696209345174798566,tweet_id:1696209345174798566
Inside NU,@insidenu,2023-08-28T17:11:14.000Z,False,Braun on the RB room post-Hull: “Cam Porter is awesome. His maturity and the way he carries himself… Anthony Tyus [is] what you want in a Big Ten back. Joseph Himon continues to really impress me.”,0,0,15,2.8K,[],[],[],https://pbs.twimg.com/profile_images/867121551665225728/Eo23-Nxa_x96.jpg,https://twitter.com/insidenu/status/1696208833763229813,tweet_id:1696208833763229813
Inside NU,@insidenu,2023-08-28T17:09:54.000Z,False,"Braun says captains will be announced this week, notes he’s really impressed by the number of different players that were voted for.",0,0,4,2.3K,[],[],[],https://pbs.twimg.com/profile_images/867121551665225728/Eo23-Nxa_x96.jpg,https://twitter.com/insidenu/status/1696208499275976920,tweet_id:1696208499275976920
Inside NU,@insidenu,2023-08-28T17:08:29.000Z,False,"Braun says they’ve made the decision on a starting quarterback, but will be keeping the decision in-house.",4,16,19,32K,[],[],[],https://pbs.twimg.com/profile_images/867121551665225728/Eo23-Nxa_x96.jpg,https://twitter.com/insidenu/status/1696208140692287504,tweet_id:1696208140692287504
Inside NU,@insidenu,2023-08-28T17:07:52.000Z,False,"Braun: “We have quite a task on our hands. Having the chance to look at Rutgers over the course of the last few months… we’re playing a team that’s well prepared, well coached, very fundamentally sound and will play a physical brand of Big Ten football.”",0,0,7,2.9K,[],[],[],https://pbs.twimg.com/profile_images/867121551665225728/Eo23-Nxa_x96.jpg,https://twitter.com/insidenu/status/1696207987667312741,tweet_id:1696207987667312741
Inside NU,@insidenu,2023-08-28T17:06:03.000Z,False,First regular season presser on the way! David Braun speaking first.,0,1,10,2.6K,[],[],[],https://pbs.twimg.com/profile_images/867121551665225728/Eo23-Nxa_x96.jpg,https://twitter.com/insidenu/status/1696207527694729614,tweet_id:1696207527694729614
Inside NU,@insidenu,2023-08-28T17:01:14.000Z,False,You can probably tell that it's an odd year.,0,2,3,1.8K,[],[],[],https://pbs.twimg.com/profile_images/867121551665225728/Eo23-Nxa_x96.jpg,https://twitter.com/insidenu/status/1696206315415089570,tweet_id:1696206315415089570
Inside NU,@insidenu,2023-08-28T15:55:32.000Z,False,"After making history in 2022, the 'Cats have a chance to do it again.",0,0,2,1.6K,[],[],[],https://pbs.twimg.com/profile_images/867121551665225728/Eo23-Nxa_x96.jpg,https://twitter.com/insidenu/status/1696189784337596809,tweet_id:1696189784337596809
Inside NU,@insidenu,2023-08-27T20:58:12.000Z,False,"Year 3 of the Russell Payne era is off to a hot start, and Northwestern is 2-0 for the first time since 2014 ",0,1,24,6.8K,[],[],['\\U0001f440'],https://pbs.twimg.com/profile_images/867121551665225728/Eo23-Nxa_x96.jpg,https://twitter.com/insidenu/status/1695903562893586924,tweet_id:1695903562893586924
Inside NU,@insidenu,2023-08-27T20:55:49.000Z,False,"Northwestern outshot Louisville 21-3, and the Cardinals didn’t even get a shot off until the second half. Just a really tough break for the No. 2 Wildcats, who drop their season opener for the first time since 2018.",0,2,11,6.9K,[],[],[],https://pbs.twimg.com/profile_images/867121551665225728/Eo23-Nxa_x96.jpg,https://twitter.com/insidenu/status/1695902964244709729,tweet_id:1695902964244709729
Inside NU,@insidenu,2023-08-27T17:19:57.000Z,True,*Evan Hull hive buzz intensifies*,1,3,44,11K,[],[],[],https://pbs.twimg.com/profile_images/867121551665225728/Eo23-Nxa_x96.jpg,https://twitter.com/insidenu/status/1695848640852430999,tweet_id:1695848640852430999
Inside NU,@insidenu,2023-08-27T16:17:27.000Z,False,"Could Evan Hull start for the Colts? Can Rashawn Slater returning finally push the Chargers over the hump? 

Ahead of the NFL season starting, find out which Wildcats are primed to make an impact in the pros.",1,2,10,4.9K,[],[],[],https://pbs.twimg.com/profile_images/867121551665225728/Eo23-Nxa_x96.jpg,https://twitter.com/insidenu/status/1695832909326815362,tweet_id:1695832909326815362
Inside NU,@insidenu,2023-08-26T16:13:09.000Z,False,"From the Wildcats’ upcoming football season to even decarbonizing the transportation sector, we cover it all in our latest mailbag.",0,1,2,3.7K,[],[],[],https://pbs.twimg.com/profile_images/867121551665225728/Eo23-Nxa_x96.jpg,https://twitter.com/insidenu/status/1695469441620812121,tweet_id:1695469441620812121
Inside NU,@insidenu,2023-08-26T15:52:26.000Z,False,"When Northwestern begins its 2023 season at Rutgers, it will have faced a Big Ten team in its opener in four straight seasons — something the ‘Cats haven’t done in more than 40 years.

That, and more fun facts about the Wildcats’ slate:",0,1,7,2.4K,[],[],[],https://pbs.twimg.com/profile_images/867121551665225728/Eo23-Nxa_x96.jpg,https://twitter.com/insidenu/status/1695464228532916416,tweet_id:1695464228532916416
Inside NU,@insidenu,2023-08-26T15:33:12.000Z,False,"As Northwestern goes through its final mock game before starting the 2023 season, its quarterback position is still up for grabs.

Whoever is under center will significantly alter the ‘Cats’ playbook this upcoming year.",0,1,4,1.9K,[],[],[],https://pbs.twimg.com/profile_images/867121551665225728/Eo23-Nxa_x96.jpg,https://twitter.com/insidenu/status/1695459388104868108,tweet_id:1695459388104868108
Inside NU,@insidenu,2023-08-25T19:04:34.000Z,False,Bump on this!!,0,0,3,3.4K,[],[],[],https://pbs.twimg.com/profile_images/867121551665225728/Eo23-Nxa_x96.jpg,https://twitter.com/insidenu/status/1695150192104718581,tweet_id:1695150192104718581
Inside NU,@insidenu,2023-08-25T19:00:57.000Z,False,"In 2022, the Illini had their first winning season since 2011. But, can Illinois replace the talent lost from that team and do it again in 2023?",0,1,1,1.8K,[],[],[],https://pbs.twimg.com/profile_images/867121551665225728/Eo23-Nxa_x96.jpg,https://twitter.com/insidenu/status/1695149280133034044,tweet_id:1695149280133034044
Inside NU,@insidenu,2023-08-25T03:33:20.000Z,False,SIT DOWN YOUNG FELLA,1,0,30,7.3K,[],[],[],https://pbs.twimg.com/profile_images/867121551665225728/Eo23-Nxa_x96.jpg,https://twitter.com/insidenu/status/1694915838292238694,tweet_id:1694915838292238694
Inside NU,@insidenu,2023-08-25T03:12:04.000Z,False, for Aulicino and a dominant 7-0 win!!,0,0,7,4.8K,[],[],"['\\U0001f3a9', '\\U0001f3a9', '\\U0001f3a9']",https://pbs.twimg.com/profile_images/867121551665225728/Eo23-Nxa_x96.jpg,https://twitter.com/insidenu/status/1694910486410637811,tweet_id:1694910486410637811
Inside NU,@insidenu,2023-08-25T00:15:33.000Z,False,Side note: First dub in a season opener for NU since 2018!,0,0,2,950,[],[],[],https://pbs.twimg.com/profile_images/867121551665225728/Eo23-Nxa_x96.jpg,https://twitter.com/insidenu/status/1694866062397841901,tweet_id:1694866062397841901
Inside NU,@insidenu,2023-08-25T00:13:33.000Z,False,We gather here today to celebrate the size of this absolutely magnificent (season-opening) W,1,0,14,6.6K,[],[],[],https://pbs.twimg.com/profile_images/867121551665225728/Eo23-Nxa_x96.jpg,https://twitter.com/insidenu/status/1694865559400202281,tweet_id:1694865559400202281
Inside NU,@insidenu,2023-08-24T16:17:54.000Z,False,"Even with a new head coach, two new coordinators and a new face under center, the Boilermakers are looking to reload rather than rebuild.",0,0,1,1.6K,[],[],[],https://pbs.twimg.com/profile_images/867121551665225728/Eo23-Nxa_x96.jpg,https://twitter.com/insidenu/status/1694745860158914719,tweet_id:1694745860158914719
Inside NU,@insidenu,2023-08-24T15:55:08.000Z,False,"As Northwestern concludes its fall camp and transitions to prep week against Rutgers, hear from head coach David Braun — plus RB Cam Porter, WR Cam Johnson and DL Sean McLaughlin — about the Wildcats’ quarterback battle, team cohesion and more.",2,2,5,2.4K,[],[],[],https://pbs.twimg.com/profile_images/867121551665225728/Eo23-Nxa_x96.jpg,https://twitter.com/insidenu/status/1694740129976365445,tweet_id:1694740129976365445
Inside NU,@insidenu,2023-08-23T19:04:17.000Z,False,"“For the first time in a long time, there are thoughts of a Northwestern baseball future that, instead of referencing its demise, are about players thriving within the program because of Greenspan at the helm.” writes ",0,4,20,3.2K,[],['@sophia_vlahakis'],[],https://pbs.twimg.com/profile_images/867121551665225728/Eo23-Nxa_x96.jpg,https://twitter.com/insidenu/status/1694425343275262446,tweet_id:1694425343275262446
Inside NU,@insidenu,2023-08-23T19:03:35.000Z,False,"After a slew of changes this offseason, the Wisconsin Badgers look like the preseason favorite to win the Big Ten West in 2023. 

However, whether all the moves on paper will work out on the field is still yet to be seen.",0,0,2,1.5K,[],[],[],https://pbs.twimg.com/profile_images/867121551665225728/Eo23-Nxa_x96.jpg,https://twitter.com/insidenu/status/1694425168678994327,tweet_id:1694425168678994327
Inside NU,@insidenu,2023-08-23T18:01:19.000Z,False,"That’s all for today’s presser. We will hear from Northwestern Football next on Monday, two days after the team’s mock game.",0,0,4,1.5K,[],[],[],https://pbs.twimg.com/profile_images/867121551665225728/Eo23-Nxa_x96.jpg,https://twitter.com/insidenu/status/1694409498654355551,tweet_id:1694409498654355551
