Name,Handle,Timestamp,Verified,Content,Comments,Retweets,Likes,Analytics,Tags,Mentions,Emojis,Profile Image,Tweet Link,Tweet ID
Dave,@BringOutDaGongs,2023-12-18T22:02:18.000Z,False,Shame you’ll go after Devito for making some money more than northwestern football hazing. You rat fuck!,0,0,0,28,[],[],[],https://pbs.twimg.com/profile_images/1655771517828100096/kVSesVzy_x96.jpg,https://twitter.com/BringOutDaGongs/status/1736869523972837769,tweet_id:1736869523972837769
Cubbie-blue,@bluecubbie1,2023-12-14T02:41:59.000Z,False,Same with Northwestern….Didn’t their football coach get fired because of widespread sexual harassment hazing….and racism.,2,0,2,247,[],[],[],https://pbs.twimg.com/profile_images/652125823923720193/k6rtz6W4_x96.jpg,https://twitter.com/bluecubbie1/status/1735127970115621193,tweet_id:1735127970115621193
Kyle Bielfeldt,@KBielfeldt,2023-11-28T17:25:14.000Z,False,Seems like satire but I bet it isn't...4 wins is the new standard in college football. Take a look at Northwestern's turn around amid a scandal and new coach!,0,0,0,76,[],[],[],https://pbs.twimg.com/profile_images/1072866187552280576/l8H5nOKq_x96.jpg,https://twitter.com/KBielfeldt/status/1729552038512525528,tweet_id:1729552038512525528
Jerome Hatlewick,@JHatlewick,2023-11-26T16:27:33.000Z,False,David Braun lifted a 1 win Northwestern football program embroiled in a hazing scandal to 7 wins this season. Braun had never been a head coach at any level previously.,0,0,6,951,[],[],[],https://pbs.twimg.com/profile_images/1500638237743796227/5wgYXvom_x96.jpg,https://twitter.com/JHatlewick/status/1728812746903593345,tweet_id:1728812746903593345
Titan Promotions,@RobertInIowa,2023-11-26T15:05:36.000Z,False,"Northwestern with a coaching change, scandal, supposedly lower quality players.  Nebraska football truly sucks",0,0,0,129,[],[],[],https://pbs.twimg.com/profile_images/378800000859232701/qDVdS8nX_x96.jpeg,https://twitter.com/RobertInIowa/status/1728792122713632877,tweet_id:1728792122713632877
Lou Kost,@kost_lou,2023-11-26T00:20:11.000Z,False,"I’m just saying if college football gave out a coach of the year award, the guy at northwestern would win it! Last year they were 0 for America, lost their HC and had that scandal and this guy takes em to a bowl game! Shit",0,0,1,155,[],[],[],https://pbs.twimg.com/profile_images/1728925350728491008/h6kH8nXp_x96.jpg,https://twitter.com/kost_lou/status/1728569301299589185,tweet_id:1728569301299589185
Beau Rehner,@BeauRehner,2023-11-25T23:48:33.000Z,False,It’s time to start a dialogue that the Northwestern football hazing scandal may have saved the program.,0,0,0,106,[],[],[],https://pbs.twimg.com/profile_images/1750763692470542336/CayYuGYd_x96.jpg,https://twitter.com/BeauRehner/status/1728561341869478127,tweet_id:1728561341869478127
.,@100001b,2023-11-25T13:28:37.000Z,False,"Trust me, we have had our fair share of hazing across youth sports in the US. The football coach for Northwestern University was recently fired for a hazing scandal.",1,0,3,64,[],[],[],https://pbs.twimg.com/profile_images/1460733053026852874/DN_7lM2I_x96.jpg,https://twitter.com/100001b/status/1728405330994848017,tweet_id:1728405330994848017
RockyTopBucs,@RockyTopBucs,2023-11-21T15:40:02.000Z,False,"Or full of the other team's fans. Nobody has noticed that inspite of all the scandal they had, Northwestern won six football games this year.",0,0,0,49,[],[],[],https://pbs.twimg.com/profile_images/1749468828495388674/58ccEiKL_x96.jpg,https://twitter.com/RockyTopBucs/status/1726988851439362069,tweet_id:1726988851439362069
theater of dreams usher,@sugarfreeprimoz,2023-11-18T21:08:42.000Z,False,Good thing my Northwestern Wildcats have never had a football scandal.,0,0,1,21,[],[],[],https://pbs.twimg.com/profile_images/1695563640940765185/P59YcmqA_x96.jpg,https://twitter.com/sugarfreeprimoz/status/1725984397592039700,tweet_id:1725984397592039700
Sawyer Niedens,@Big12BurnerKU,2023-11-18T20:52:30.000Z,False,Can we talk about how Northwestern nearly not being able to play football due to a scandal and then now being bowl eligible with a different coach?,0,0,2,178,[],[],[],https://pbs.twimg.com/profile_images/1749952376260210689/d798elRG_x96.jpg,https://twitter.com/Big12BurnerKU/status/1725980320288096440,tweet_id:1725980320288096440
Faux George McCaskey *Parody*,@FauxMcCaskey,2023-11-18T20:16:03.000Z,False,"Five Months ago, everyone would've just sat & laughed their asses off at the people who said Northwestern was going to a bowl game this year after all the hazing off the field; They are now. What a story & one of the best ones in a while! This is why people love college football!",0,0,2,321,[],[],[],https://pbs.twimg.com/profile_images/1745289513151168512/MmmDt88A_x96.jpg,https://twitter.com/FauxMcCaskey/status/1725971148565840057,tweet_id:1725971148565840057
Rhinosdemise,@rhinosdemise,2023-11-18T17:29:40.000Z,False,"Pat Fitzgerald was fired at northwestern this year for team hazing that was going on even though pat didn't know it was happening. Didn't matter, it was his football program. Same thing for harbaugh, doesn't matter if he didn't know. It's his program.",0,0,0,84,[],[],[],https://pbs.twimg.com/profile_images/1493041811782262787/CcUdfZ1z_x96.jpg,https://twitter.com/rhinosdemise/status/1725929277898506395,tweet_id:1725929277898506395
Donjon2,@TheDonJulio1,2023-11-18T07:48:11.000Z,False,"  Sports Business Reporter 
Has Commented more times on Charissa Thompson
Then anything on Northwestern football regarding butt stuff and hazing at his Alma mater 

And we’re upset she covered up for a coach not wanting to talk for 15 seconds",0,0,1,96,[],['@darrenrovell'],[],https://pbs.twimg.com/profile_images/1753714307500494848/h0mleZpu_x96.jpg,https://twitter.com/TheDonJulio1/status/1725782941513453934,tweet_id:1725782941513453934
Montgomery Brogan,@Monty_Brogann,2023-11-17T16:16:33.000Z,False,What do you say about Northwestern football hazing?,0,0,0,52,[],[],[],https://pbs.twimg.com/profile_images/1677770729591300097/OBKUWbFJ_x96.jpg,https://twitter.com/Monty_Brogann/status/1725548487301910783,tweet_id:1725548487301910783
Isaac (Greece trip in September 2024),@isaacfromFL,2023-11-15T23:43:24.000Z,False,David Braun becomes Northwestern's fulltime football coach after having taken over for the fired Pat Fitzgerald following hazing allegations with the program,0,0,0,63,[],[],[],https://pbs.twimg.com/profile_images/1697991503216312320/BfBU7xZV_x96.jpg,https://twitter.com/isaacfromFL/status/1724936165520728291,tweet_id:1724936165520728291
Brian Pia,@brianpia,2023-11-15T19:06:59.000Z,True,"ESPN: #Northwestern will make #DavidBraun head football coach and remove his interim label. Team is 5-5 under Braun who turned the Wildcats program around after a 1-11 season last year. Overcame an off-season #hazing scandal, too.",0,0,0,338,"['#Northwestern', '#DavidBraun', '#hazing']",[],[],https://pbs.twimg.com/profile_images/1497392454584221696/-3JrNNzD_x96.jpg,https://twitter.com/brianpia/status/1724866604125630869,tweet_id:1724866604125630869
robertschmidt34,@robertschmidt34,2023-11-15T17:00:55.000Z,False,"Braun is bringing back my excitement for Northwestern football.  5-5 may not seem like a successful season but after the hazing scandal, Fitzgerald being fired.  Braun embodies what we are looking for in a head coach.",0,0,0,106,[],[],[],https://pbs.twimg.com/profile_images/1602469670963056640/EivUb59m_x96.jpg,https://twitter.com/robertschmidt34/status/1724834877466435960,tweet_id:1724834877466435960
Chicago Tribune Sports,@ChicagoSports,2023-11-14T21:29:06.000Z,False,Northwestern's David Braun appears to be the biggest winner among the Big Ten’s first-year football coaches. The Wildcats are in a position few would have envisioned when Braun became interim coach in the wake of a scandal that cost Pat Fitzgerald his job.,0,1,3,1.3K,[],[],[],https://pbs.twimg.com/profile_images/1159866085379858432/Eg3rFEas_x96.jpg,https://twitter.com/ChicagoSports/status/1724539978892390889,tweet_id:1724539978892390889
b yen,@jumplive,2023-11-12T20:30:01.000Z,False,"#gaza   @LadyDoctorSays 
Michael Schill (UofOregon President 2015-2022) reputation not-so-good..""didn't have best interests of students in mind""
Hired at Northwestern 2022, HUGE Football 2023 hazing scandal. BAD look, BIG lawsuithttps://reddit.com/r/UofO/comments/ks77x9/why_is_michael_schill_so_hated/…",0,0,1,335,['#gaza'],"['@IBJIYONGI', '@timnitGebru']",[],https://pbs.twimg.com/profile_images/55678241/amcmillin_x96.jpg,https://twitter.com/jumplive/status/1723800335968514191,tweet_id:1723800335968514191
Kevin Craig,@celibacyrules31,2023-11-12T09:36:58.000Z,True,"I guess most of the football hazing at northwestern took place at a camp in Wisconsin 
That seemed strange to me 
You know I had a Milwaukee bucks flag in my apartment in Columbia once? 
Interesting right",0,1,0,97,[],[],[],https://pbs.twimg.com/profile_images/1728899745601470464/32aQfE0C_x96.jpg,https://twitter.com/celibacyrules31/status/1723635991527714829,tweet_id:1723635991527714829
Julie’s Peabody,@JuliesPeabody,2023-11-11T03:48:32.000Z,False,Laz now celebrating a win by Northwestern.  How can he do that without reminding people to think about the football scandal??,1,0,2,212,[],[],[],https://pbs.twimg.com/profile_images/884840732351234049/DVliiOWb_x96.jpg,https://twitter.com/JuliesPeabody/status/1723185917211336797,tweet_id:1723185917211336797
Dr. Fabilus,@DavidFabi1,2023-11-10T00:13:31.000Z,False,He talks about high integrity of Coach Fitz at NW. Where was his integrity with all the gross hazing taking place with the Northwestern Football Team? Now thats sickening and Bielema just looks foolish using NW as an example.,0,0,1,117,[],[],[],https://pbs.twimg.com/profile_images/1203757738322477057/dvQFV28-_x96.jpg,https://twitter.com/DavidFabi1/status/1722769418881777760,tweet_id:1722769418881777760
The Gordie Center,@GordieCenter,2023-11-09T00:00:01.000Z,False,"https://abc7chicago.com/northwestern-university-football-lawsuit-hazing/14007572/…""A group of former Northwestern football players shared stories of hazing and racism they say they experienced on the team. More than 50 former student-athletes have filed lawsuits claiming they experienced physical and mental harm.""",0,0,0,45,[],[],[],https://pbs.twimg.com/profile_images/834446558603010048/LZBm9GfA_x96.jpg,https://twitter.com/GordieCenter/status/1722403634657567074,tweet_id:1722403634657567074
Connor Townsend,@ConnorATownsend,2023-11-08T17:41:55.000Z,True,"The 4 biggest schools in the conference have each had a sexual abuse scandal in the last ~ decade.Northwestern fired their most famous football alum after a major hazing scandal THIS SUMMER.

If we are ranking Big Ten scandals, Connor Stallions isn't even Top 10 of the decade.",1,1,1,537,[],[],[],https://pbs.twimg.com/profile_images/1564012327653064704/HUTA2CBW_x96.jpg,https://twitter.com/ConnorATownsend/status/1722308482790019462,tweet_id:1722308482790019462
Jason Alt,@littlewyvern,2023-11-08T04:53:58.000Z,True,It’s amazing that Northwestern somehow didn’t even manage to have the worst football program scandal in the Big Ten this year.,0,0,0,35,[],[],[],https://pbs.twimg.com/profile_images/1672604098770661377/Uun1EI61_x96.jpg,https://twitter.com/littlewyvern/status/1722115218187211116,tweet_id:1722115218187211116
barkerrd #barkerrd,@barkerrd,2023-11-08T00:49:33.000Z,False,Where Things Stand With the Northwestern Hazing Scandal Heading Into Football Season.,0,0,1,35,[],[],[],https://pbs.twimg.com/profile_images/1621549862448758786/sPQX8y8t_x96.jpg,https://twitter.com/barkerrd/status/1722053708903530827,tweet_id:1722053708903530827
Dublin Buckeye,@DublinBuckeye,2023-11-07T17:27:01.000Z,False,"What that is, I don’t know. Northwestern football announced the firing of alum & football coach Pat Fitzgerald. It marked a shocking reversal from the university's previous announcement days earlier that it would suspend him after hazing was uncovered in his football program.",1,0,0,47,[],[],[],https://pbs.twimg.com/profile_images/1216348488059052036/nqKlI4-t_x96.jpg,https://twitter.com/DublinBuckeye/status/1721942342725214440,tweet_id:1721942342725214440
Alex Drain,@Alex_Drain,2023-11-07T06:08:48.000Z,False,"we've had 

Sandusky, Nassar, Robert Anderson, Richard Strauss. 
Jordan McNair died during a football practice. We just had a mass-hazing/abuse scandal at Northwestern. 

But yes, cry to me more about how Connor Stalions damaged the sanctity of the B1G's image",1,17,191,4.3K,[],[],[],https://pbs.twimg.com/profile_images/1610804238703009793/FG9D3UDD_x96.jpg,https://twitter.com/Alex_Drain/status/1721771662683627547,tweet_id:1721771662683627547
J-E-T-S JETS JETS JETS,@Nyjetsmets,2023-11-07T04:47:32.000Z,False,"If Darrel Rovell staying silent all college football season on the scandal involving his beloved Northwestern and dear friend Pat Fitzgerald didn’t hurt your trust of journalism then the shenanigans he is always pulling should.  He too should be investigated by the SEC, why not?",0,0,0,215,[],[],[],https://pbs.twimg.com/profile_images/1633132268049793027/C-1xiiuI_x96.jpg,https://twitter.com/Nyjetsmets/status/1721751214839185732,tweet_id:1721751214839185732
CBS Chicago,@cbschicago,2023-11-04T01:00:26.000Z,True,More former Northwestern football players come forward amid hazing scandal https://cbsnews.com/chicago/news/more-former-northwestern-football-players-come-forward-hazing-scandal/?taid=6545979bb754f300011e990f&utm_campaign=trueAnthem%3A+Trending+Content&utm_medium=trueAnthem&utm_source=twitter…,2,1,3,2.5K,[],[],[],https://pbs.twimg.com/profile_images/1654206644002193410/tIpOMvrc_x96.jpg,https://twitter.com/cbschicago/status/1720606898318119324,tweet_id:1720606898318119324
"Salvi, Schostok & Pritchard P.C.",@SalviLaw,2023-11-03T19:20:37.000Z,False,"WATCH NOW:  Today, 8 former #Northwestern football players stood together to share stories of how they were subjected to hazing, sexual and physical abuse, racial discrimination, and other dehumanizing acts while part of the athletic program. 

Full video:",0,0,0,132,['#Northwestern'],[],[],https://pbs.twimg.com/profile_images/1684299570971308033/Yk7_qH8A_x96.jpg,https://twitter.com/SalviLaw/status/1720521381744415062,tweet_id:1720521381744415062
25NewsKXXV,@25NewsKXXV,2023-11-03T19:00:21.000Z,False,"Former Northwestern football players share hazing, racism accusations https://kxxv.com/former-northwestern-players-share-hazing-racism-accusations…",0,0,0,270,[],[],[],https://pbs.twimg.com/profile_images/1168474171824922630/BbcWKtUc_x96.jpg,https://twitter.com/25NewsKXXV/status/1720516279260295486,tweet_id:1720516279260295486
NIL vs NLI,@NILvsNLI,2023-11-03T18:28:25.000Z,False,"Former Northwestern University Football players shared stories of hazing and racism they say they experienced on the team (from )

More than 50 former student-athletes have filed lawsuits claiming they experienced physical and mental harm",0,0,0,60,[],['@donofrioABC7'],[],https://pbs.twimg.com/profile_images/1680954083031785472/zZbR4fbg_x96.jpg,https://twitter.com/NILvsNLI/status/1720508243943026988,tweet_id:1720508243943026988
CollegeAD,@collegead,2023-11-03T17:36:21.000Z,True,"#UNCAsheville names Tyler Ferris Assistant AD for Advancement plus Former #Northwestern football players share hazing, racism accusations.  http://bit.ly/collegeadnewsfeed…",0,1,1,1.6K,"['#UNCAsheville', '#Northwestern']",[],['\\U0001f4c3'],https://pbs.twimg.com/profile_images/1252681320712605703/dtWnDZyn_x96.jpg,https://twitter.com/collegead/status/1720495142665384174,tweet_id:1720495142665384174
CBS Chicago,@cbschicago,2023-11-03T17:30:15.000Z,True,More former Northwestern football players come forward amid hazing scandal https://cbsnews.com/chicago/news/more-former-northwestern-football-players-come-forward-hazing-scandal/?taid=65452e269f9ae30001402d0a&utm_campaign=trueAnthem%3A+Trending+Content&utm_medium=trueAnthem&utm_source=twitter…,0,0,1,1.5K,[],[],[],https://pbs.twimg.com/profile_images/1654206644002193410/tIpOMvrc_x96.jpg,https://twitter.com/cbschicago/status/1720493606190915959,tweet_id:1720493606190915959
Thenewsbeat.net,@newsexpress_xyz,2023-11-03T14:39:28.000Z,False,"Former NU athletes share experience with racism, hazing for first time
 
CHICAGO — A group of former Northwestern University football players who were subjected to racial ...
 #athletes #experience #hazing #racism #share #time",0,0,0,5,"['#athletes', '#experience', '#hazing', '#racism', '#share', '#time']",[],[],https://pbs.twimg.com/profile_images/1685367002498809856/QrPVk4x0_x96.jpg,https://twitter.com/newsexpress_xyz/status/1720450628525445433,tweet_id:1720450628525445433
thenewsbeat.net,@Newsexpres_xyz,2023-11-03T14:36:51.000Z,False,"Former NU athletes share experience with racism, hazing for first time
 
CHICAGO — A group of former Northwestern University football players who were subjected to racial ...
 #athletes #experience #hazing #racism #share #timehttps://thenewsbeat.net/former-nu-athletes-share-experience-with-racism-hazing-for-first-time/?feed_id=192170&_unique_id=654505831e148&Former%20NU%20athletes%20share%20experience%20with%20racism%2C%20hazing%20for%20first%20time654505831e27f…",0,0,0,5,"['#athletes', '#experience', '#hazing', '#racism', '#share', '#time']",[],[],https://pbs.twimg.com/profile_images/1634621728872693764/HtHbDFVG_x96.png,https://twitter.com/Newsexpres_xyz/status/1720449969239302543,tweet_id:1720449969239302543
ABC 10News San Diego,@10News,2023-11-03T13:45:00.000Z,False,"Former Northwestern football players share hazing, racism accusations",1,1,1,1.4K,[],[],[],https://pbs.twimg.com/profile_images/1499848122603687938/Ymn7coYT_x96.jpg,https://twitter.com/10News/status/1720436919132209615,tweet_id:1720436919132209615
LFT411,@LFT411,2023-11-03T12:30:36.000Z,False,"RT  ""Former Northwestern football players share hazing, racism accusations https://katc.com/former-northwestern-players-share-hazing-racism-accusations…""",0,0,0,90,[],['@KATCTV3'],[],https://pbs.twimg.com/profile_images/1783572042/200px-Fleur-de-lis-fill_x96.jpg,https://twitter.com/LFT411/status/1720418195973046585,tweet_id:1720418195973046585
Scripps News,@scrippsnews,2023-11-03T12:30:29.000Z,False,Former Northwestern University football players are sharing previously undisclosed racism and hazing experiences.,0,0,0,698,[],[],[],https://pbs.twimg.com/profile_images/1648781692629336065/y6xUrTO9_x96.jpg,https://twitter.com/scrippsnews/status/1720418168047337903,tweet_id:1720418168047337903
KATC TV3,@KATCTV3,2023-11-03T12:30:03.000Z,False,"Former Northwestern football players share hazing, racism accusations",3,0,2,2.3K,[],[],[],https://pbs.twimg.com/profile_images/1674136913882632207/ZZ4hKo-t_x96.png,https://twitter.com/KATCTV3/status/1720418057212813437,tweet_id:1720418057212813437
Matt Fortuna,@Matt_Fortuna,2023-11-03T12:29:01.000Z,False,"Several former Northwestern football players who say they were subjected to racial discrimination, hazing, physical abuse and retaliation will hold a news conference at 9 a.m. to share their stories.

They’re repped by Salvi, Schostok & Prtichard, P.C. and co-counsel Stinar Law.",1,4,18,10K,[],[],[],https://pbs.twimg.com/profile_images/1687124154019954688/DAxHmc_S_x96.jpg,https://twitter.com/Matt_Fortuna/status/1720417799288320130,tweet_id:1720417799288320130
ABC 7 Chicago,@ABC7Chicago,2023-11-03T11:40:30.000Z,True,"A group of former Northwestern football players will share stories of hazing, and racism they say they experienced on the team.",7,12,13,16K,[],[],[],https://pbs.twimg.com/profile_images/1095472008127627265/9q9RSasl_x96.png,https://twitter.com/ABC7Chicago/status/1720405587735748789,tweet_id:1720405587735748789
ChicagoMediaX,@chicagomediaX,2023-11-03T11:32:07.000Z,False,"Former Northwestern football players to speak on alleged hazing, racism",0,0,0,53,[],[],[],https://pbs.twimg.com/profile_images/1305591215749029889/cHyOlSQA_x96.jpg,https://twitter.com/chicagomediaX/status/1720403477292290456,tweet_id:1720403477292290456
Denver7 News,@DenverChannel,2023-11-03T11:30:00.000Z,True,"Former Northwestern University football players are opening up about previously undisclosed racism and hazing experiences, marking the first time these stories have come to light for the public, according to their attorneys.",0,0,1,1.8K,[],[],[],https://pbs.twimg.com/profile_images/1753568749502840832/bGsZRQHE_x96.jpg,https://twitter.com/DenverChannel/status/1720402945039073625,tweet_id:1720402945039073625
"Salvi, Schostok & Pritchard P.C.",@SalviLaw,2023-11-03T11:04:05.000Z,False,"PRESS CONFERENCE: A group of former #Northwestern football players who were subjected to racism, hazing, physical abuse, and retaliation will share their stories for the first time ahead of Northwestern’s football game at Wrigley Field.",0,0,1,179,['#Northwestern'],[],[],https://pbs.twimg.com/profile_images/1684299570971308033/Yk7_qH8A_x96.jpg,https://twitter.com/SalviLaw/status/1720396423210873302,tweet_id:1720396423210873302
WCPO 9,@WCPO,2023-11-03T11:04:02.000Z,True,"Former Northwestern football players share hazing, racism accusations",0,0,0,1.9K,[],[],[],https://pbs.twimg.com/profile_images/1224385852723298304/xI66vg88_x96.jpg,https://twitter.com/WCPO/status/1720396411785687062,tweet_id:1720396411785687062
TCruse,@TheCruseman,2023-11-02T22:27:42.000Z,False,"The ESPN reporter that broke the Michigan ‘scouting’ scandal (Adam Rittenberg) also broke the Northwestern hazing ‘scandal’, Iowa football racism allegations, and many more B1G ‘scandals’. Guy has an agenda, even if later proven untrue",0,0,1,60,[],[],[],https://pbs.twimg.com/profile_images/1602451367863484417/3cpGPuWJ_x96.jpg,https://twitter.com/TheCruseman/status/1720206075369013287,tweet_id:1720206075369013287
UncleHeavyD,@montedamastiff,2023-10-31T17:33:25.000Z,False,Looks like Northwestern football hazing,0,0,0,47,[],[],[],https://pbs.twimg.com/profile_images/2324085285/8nathi9kar8m3vsz9zif_x96.jpeg,https://twitter.com/montedamastiff/status/1719407238756888737,tweet_id:1719407238756888737
young s choi,@youngschoi2,2023-10-31T04:04:33.000Z,False,"4 more Northwestern football alums underwent 'ritualized sexual' hazing, they say https://nbcnews.com/news/us-news/4-northwestern-football-alum-come-forward-hazing-abuse-allegations-rcna95085… via ",0,0,0,44,[],['@nbcnews'],[],https://pbs.twimg.com/profile_images/1359149940287524866/nK6T-Hum_x96.jpg,https://twitter.com/youngschoi2/status/1719203679646183720,tweet_id:1719203679646183720
verbosedutch,@verbosedutch,2023-10-29T16:23:00.000Z,False,"Northwestern went 1-11 last year, lost their longtime HC after a hazing scandal & has gone 4-4 this szn w/ a guy who was a FCS DC 11 months ago. Northwestern has a legitimate chance to go to a bowl this szn…(Just a measuring stick for MSU football the past 2 seasons.)",5,0,69,3.3K,[],[],['\\U0001fae0'],https://pbs.twimg.com/profile_images/654670960008671233/jCUgN_QL_x96.jpg,https://twitter.com/verbosedutch/status/1718664741546033577,tweet_id:1718664741546033577
WashTimes Sports,@WashTimesSports,2023-10-26T23:02:20.000Z,True,Maryland will try to reach bowl eligibility and try to end a two-game losing streak at Northwestern as Michigan's sign-stealing scandal swirls around the Big Ten and college football.,0,0,0,146,[],[],[],https://pbs.twimg.com/profile_images/1752058359287623680/-wLArQNL_x96.png,https://twitter.com/WashTimesSports/status/1717678075377295555,tweet_id:1717678075377295555
sarge,@sarge__msu,2023-10-26T15:38:15.000Z,False,it's pretty amazing Pat Fitzgerald getting fired for a rampant hazing scandal at Northwestern is essentially an afterthought in the story of B1G Football in the year 2023,8,9,180,9.9K,[],[],[],https://pbs.twimg.com/profile_images/1705929738357768192/QLnS7tdP_x96.jpg,https://twitter.com/sarge__msu/status/1717566318243713261,tweet_id:1717566318243713261
VOLNUGS,@VOLNUGS,2023-10-23T20:53:41.000Z,False,Stewart has commented on three stories the ENTIRE football season. I guess he is tired of Northwestern hazing and blowing Colorado and has turned to a new fetish....watching games in person!!!,0,0,0,1.3K,[],[],[],https://pbs.twimg.com/profile_images/1011476012377358336/uCreqMNf_x96.jpg,https://twitter.com/VOLNUGS/status/1716558536270897576,tweet_id:1716558536270897576
Leisure Research Institute - Coming Soon,@brother_dag,2023-10-20T21:13:10.000Z,False,the Northwestern football hazing scandal went deeper than we thought,1,0,106,5.3K,[],[],[],https://pbs.twimg.com/profile_images/1749854335427657728/2hOJ-zXC_x96.jpg,https://twitter.com/brother_dag/status/1715476273034576037,tweet_id:1715476273034576037
"CEO, Vandelay Industries",@CEOVandelay,2023-10-16T23:55:59.000Z,False,"I think a lot about how everyone was like ""how the hell did the major outlets miss this?"" when the Northwestern student paper broke the news about the football team hazing scandal. 

And this is in part why. Sports journalism is almost non-existent. Replaced by whatever this is.",0,0,0,145,[],[],[],https://pbs.twimg.com/profile_images/1562601771029204992/xt5ancas_x96.jpg,https://twitter.com/CEOVandelay/status/1714067695908385114,tweet_id:1714067695908385114
@retired_marine1,@retired_marine1,2023-10-16T11:21:45.000Z,False,"Pat Fitzgerald, Former Northwestern Football Coach, Dismissed Amid Hazing Accusations https://msn.com/en-us/sports/other/pat-fitzgerald-former-northwestern-football-coach-dismissed-amid-hazing-accusations/ar-AA1eBm9F?ocid=socialshare&cvid=e3a7644f423146e38012b7706f4a02fd&ei=11… This happened back in July/August, why is it making headlines now?",0,0,0,65,[],[],[],https://pbs.twimg.com/profile_images/1700120699128451072/zxHe44cx_x96.jpg,https://twitter.com/retired_marine1/status/1713877888162771441,tweet_id:1713877888162771441
