Name,Handle,Timestamp,Verified,Content,Comments,Retweets,Likes,Analytics,Tags,Mentions,Emojis,Profile Image,Tweet Link,Tweet ID
Louisiana Girl,@Louisiania259,2023-07-21T04:02:43.000Z,False,"4 more Northwestern football alums underwent 'ritualized sexual' hazing, they say",0,0,0,75,[],[],[],https://pbs.twimg.com/profile_images/1663108708950319104/G2RefAFp_x96.jpg,https://twitter.com/Louisiania259/status/1682239657168306176,tweet_id:1682239657168306176
Michael Cawthorne,@Michael29500056,2023-07-21T04:00:17.000Z,False,Former Northwestern football players describe intense hazing https://nbcnews.com/video/former-northwestern-football-players-describe-intense-hazing-188807749916… via ,0,1,1,73,[],['@nbcnews'],[],https://abs.twimg.com/sticky/default_profile_images/default_profile_x96.png,https://twitter.com/Michael29500056/status/1682239045299056640,tweet_id:1682239045299056640
The Comeback NCAA,@TheComebackNCAA,2023-07-21T12:04:23.000Z,False,Daily Northwestern student journalists discuss details behind Northwestern football hazing story http://ow.ly/9Ary104ORLb,0,0,0,311,[],[],[],https://pbs.twimg.com/profile_images/844698478156570624/dvDdBJKj_x96.jpg,https://twitter.com/TheComebackNCAA/status/1682360872369287168,tweet_id:1682360872369287168
Mitch Pugh,@SCMitchP,2023-07-21T10:51:33.000Z,False,"Some Northwestern football fans are ditching their tickets in the wake of the hazing scandal, firing of Fitzgerald. Story by ⁦⁩.",0,0,5,281,[],['@angie_leventis'],[],https://pbs.twimg.com/profile_images/1615929138275131397/ObmtbjhC_x96.jpg,https://twitter.com/SCMitchP/status/1682342542996537344,tweet_id:1682342542996537344
IL Sports Network,@ILSportsNetwork,2023-07-21T10:38:37.000Z,False,"Some Northwestern football fans are ditching their tickets in the wake of the hazing scandal, firing of Fitzgerald",0,0,0,99,[],[],[],https://pbs.twimg.com/profile_images/1120513231192297473/2kyUHcHI_x96.png,https://twitter.com/ILSportsNetwork/status/1682339287126142976,tweet_id:1682339287126142976
Silvia Texidor,@LadyZorra76,2023-07-21T09:00:31.000Z,False,"I have been noticing a trend with the NIL deals. They seem to be producing  Prima Donna football players who think they can do no wrong. Such examples are the hazing and abuse allegations at Northwestern in the football and baseball programs, the speeding violations at Georgia...",0,0,0,186,[],[],[],https://pbs.twimg.com/profile_images/1671558332853649414/WANpZ_eB_x96.jpg,https://twitter.com/LadyZorra76/status/1682314600862081024,tweet_id:1682314600862081024
Awful Announcing,@awfulannouncing,2023-07-21T12:05:16.000Z,False,Daily Northwestern student journalists discuss details behind Northwestern football hazing story http://ow.ly/9Ary104ORLb,0,2,10,23K,[],[],[],https://pbs.twimg.com/profile_images/760731996318490625/sdzTWMgM_x96.jpg,https://twitter.com/awfulannouncing/status/1682361094776422400,tweet_id:1682361094776422400
RevDJEsq,@RevDJEsq,2023-07-21T13:37:48.000Z,False,I'll repeat:Northwestern's failure to release the entire report from its own investigation of hazing in the football program is one of the largest legal and public relations blunders in the history of college athletics. Just a drip-drip-drip of bad headlines since then...,9,6,48,10K,[],[],[],https://pbs.twimg.com/profile_images/1268151980310093825/Vwl8UvEH_x96.jpg,https://twitter.com/RevDJEsq/status/1682384382546280450,tweet_id:1682384382546280450
Chicago Tribune,@chicagotribune,2023-07-21T13:00:21.000Z,False,"Former Northwestern athletic director Jim Phillips said he never “condoned or tolerated inappropriate conduct” in the wake of the university's hazing scandal, which has led to at least three lawsuits and the firing of football coach Pat Fitzgerald.",9,3,2,8.2K,[],[],[],https://pbs.twimg.com/profile_images/1542900856110055426/65co59gz_x96.jpg,https://twitter.com/chicagotribune/status/1682374958914105346,tweet_id:1682374958914105346
Chicago Breaking News,@ChicagoBreaking,2023-07-21T12:45:50.000Z,False,"Some Northwestern football fans are ditching their tickets in the wake of the hazing scandal, firing of Fitzgerald",1,1,4,3K,[],[],[],https://pbs.twimg.com/profile_images/1283891088487587840/uAT3yCoa_x96.jpg,https://twitter.com/ChicagoBreaking/status/1682371305713070080,tweet_id:1682371305713070080
The Comeback NCAA,@TheComebackNCAA,2023-07-21T12:06:37.000Z,False,Daily Northwestern student journalists discuss details behind Northwestern football hazing story http://ow.ly/9Ary104ORLb,0,0,0,337,[],[],[],https://pbs.twimg.com/profile_images/844698478156570624/dvDdBJKj_x96.jpg,https://twitter.com/TheComebackNCAA/status/1682361435505008640,tweet_id:1682361435505008640
DNASportsTalk,@DNASportsTalk,2023-07-21T13:48:37.000Z,False,Northwestern Football Assistant Matt McPherson Accused of Witnessing Hazing,0,0,0,177,[],[],[],https://pbs.twimg.com/profile_images/2769066811/2d6a51d8c3a89f9ff8c574dae9fac572_x96.jpeg,https://twitter.com/DNASportsTalk/status/1682387105098375169,tweet_id:1682387105098375169
Sports Illustrated,@SInow,2023-07-21T13:45:06.000Z,True,"Northwestern associate head football coach Matt MacPherson has been accused of witnessing incidents of hazing during the tenure of ex-coach Pat Fitzgerald, according to a new report from USA Today",1,9,18,40K,[],[],[],https://pbs.twimg.com/profile_images/1362549067453108227/961QcQh-_x96.jpg,https://twitter.com/SInow/status/1682386218573594625,tweet_id:1682386218573594625
Chicago Tribune Sports,@ChicagoSports,2023-07-21T14:30:09.000Z,False,"Some Northwestern football fans are grappling with whether they’ll ditch their tickets.

While some have expressed anger over the alleged hazing of players, others are in an uproar over coach Pat Fitzgerald’s dismissal.' story.",4,5,3,9.6K,[],['@angie_leventis'],[],https://pbs.twimg.com/profile_images/1159866085379858432/Eg3rFEas_x96.jpg,https://twitter.com/ChicagoSports/status/1682397555815006209,tweet_id:1682397555815006209
Ken Fang -- Very Asian,@fangsbites,2023-07-21T14:29:05.000Z,True,Daily Northwestern student journalists discuss details behind Northwestern football hazing story http://dlvr.it/SsWznm,0,0,0,384,[],[],[],https://pbs.twimg.com/profile_images/1734295303946162177/opwd8Z4q_x96.jpg,https://twitter.com/fangsbites/status/1682397287132086272,tweet_id:1682397287132086272
John U. Bacon,@Johnubacon,2023-07-21T14:00:41.000Z,False,"Podcast: one shocking leadership failure, one not. Northwestern football, which I've praised in my books, crashed due to hazing - and ""hazing"" is euphemistic. The NFL comically turned a mess into a bigger mess w/Gruden, Snyder, and Goodell - all bad guys.",1,0,3,4.8K,[],[],[],https://pbs.twimg.com/profile_images/1702030248949465088/PyC9gWyN_x96.jpg,https://twitter.com/Johnubacon/status/1682390139048271872,tweet_id:1682390139048271872
Michael D. H. Hsu,@mdhhsu,2023-07-21T15:05:31.000Z,False,More finger pointing…expect more! Northwestern associate head football coach allegedly witnessed hazing,0,1,2,337,[],[],[],https://pbs.twimg.com/profile_images/1051290549578342400/Fx3QK8_K_x96.jpg,https://twitter.com/mdhhsu/status/1682406455331246080,tweet_id:1682406455331246080
Pam Bowling,@PamBowling7,2023-07-21T15:03:23.000Z,False,"4 more Northwestern football alums underwent 'ritualized sexual' hazing, they say
“We were thrown into a culture where physical, emotional and sexual abuse was normalized,” one of the former players says.",0,0,1,65,[],[],[],https://pbs.twimg.com/profile_images/1332342061710913538/B6CgDR_-_x96.jpg,https://twitter.com/PamBowling7/status/1682405920704274442,tweet_id:1682405920704274442
Bernstein & Holmes Show,@BernsyHolmes,2023-07-21T15:00:09.000Z,False,"#Cubs' defense, Marcus Stroman struggle

Who will #WhiteSox trade at the deadline?

A Northwestern football coach who allegedly witnessed hazing has been named,  10a-12:45p

11:00  ",3,4,5,12K,"['#Cubs', '#WhiteSox']","['@dan_bernstein', '@LaurenceWHolmes', '@stevestone']","['\\U0001f3a7', '\\U0001f4bb']",https://pbs.twimg.com/profile_images/1537897899069034497/kyUYWnQO_x96.jpg,https://twitter.com/BernsyHolmes/status/1682405104522018816,tweet_id:1682405104522018816
Mark Titus Show,@MarkTitusShow,2023-07-21T15:10:58.000Z,False,Northwestern Football Scandal ,0,0,3,5.3K,[],['@BFW'],[],https://pbs.twimg.com/profile_images/1628138813850587158/5AcwSSzs_x96.jpg,https://twitter.com/MarkTitusShow/status/1682407826335907840,tweet_id:1682407826335907840
Jeff Johnson,@therealJeffJ97,2023-07-21T15:08:22.000Z,False,"The associate head coach of the Northwestern football team allegedly witnessed players doing naked pull-ups and engaging in other forms of hazing, former Northwestern player Ramon Diaz and a person in contact with several other former players told USA TODAY Sports on Thursday.",0,1,3,4.1K,[],[],['\\U0001f610'],https://pbs.twimg.com/profile_images/1490051323718479876/BA3xZV-f_x96.jpg,https://twitter.com/therealJeffJ97/status/1682407175866417156,tweet_id:1682407175866417156
Matt Fortuna,@Matt_Fortuna,2023-07-21T16:21:12.000Z,False,"Two additional former Northwestern football players have filed lawsuits against the school, Jim Phillips, Pat Fitzgerald, Michael Schill, Morton Schapiro and Derrick Gragg for hazing-related allegations.

Statement from attorneys Patrick Salvi and Parker Stinar:",0,1,4,4.8K,[],[],[],https://pbs.twimg.com/profile_images/1687124154019954688/DAxHmc_S_x96.jpg,https://twitter.com/Matt_Fortuna/status/1682425504295694337,tweet_id:1682425504295694337
Ottawa Citizen,@OttawaCitizen,2023-07-21T16:18:22.000Z,True,"As Northwestern’s football program faces a barrage of hazing allegations, The Associated Press asked all four major U.S. pro leagues about their anti-hazing policies. https://ottawacitizen.com/pmn/news-pmn/some-top-us-sports-leagues-have-specific-anti-hazing-policies-others-do-not/wcm/46a60e49-5c1f-4899-8d54-f0d7e27e32c8?utm_medium=Social&utm_source=Twitter#Echobox=1689949051…",0,0,0,2.5K,[],[],[],https://pbs.twimg.com/profile_images/1632066312288567298/EfA5HRbb_x96.jpg,https://twitter.com/OttawaCitizen/status/1682424790236164098,tweet_id:1682424790236164098
WashTimesLocal,@WashTimesLocal,2023-07-21T16:11:39.000Z,True,"Northwestern University is facing multiple lawsuits after allegations that the football program had a hazing problem for years, including ""forced participation, nudity and sexualized acts of a degrading nature.""",0,0,0,87,[],[],[],https://pbs.twimg.com/profile_images/1752058752751087616/M4D0x9em_x96.png,https://twitter.com/WashTimesLocal/status/1682423100141367296,tweet_id:1682423100141367296
Sun-Times Sports,@suntimes_sports,2023-07-21T16:58:24.000Z,False,"A third former football player at Northwestern has filed a lawsuit alleging the school fostered a culture of hazing and abuse. The former player, identified as John Doe 3, filed the suit in Cook County through his attorney Patrick Salvi Jr.",0,1,0,475,[],[],[],https://pbs.twimg.com/profile_images/978867358696726529/ZOciLJoA_x96.jpg,https://twitter.com/suntimes_sports/status/1682434863972884485,tweet_id:1682434863972884485
R. Anthony Mahavier,@CALawGuy,2023-07-21T16:39:34.000Z,False,Two former football players have filed civil lawsuits against Northwestern University over alleged hazing that occurred within the program under recently-fired coach Pat Fitzgerald. https://wsj.com/sports/football/northwestern-hazing-lawsuit-pat-fitzgerald-4c742870?st=qucqwkutq4a4j2e… via ,0,0,0,131,[],['@WSJ'],[],https://pbs.twimg.com/profile_images/551538657614520320/T3OtiFFD_x96.jpeg,https://twitter.com/CALawGuy/status/1682430125911199744,tweet_id:1682430125911199744
Post Sports,@PostSports,2023-07-21T18:20:04.000Z,True,Third former Northwestern football player files hazing lawsuit,0,0,0,979,[],[],[],https://pbs.twimg.com/profile_images/1079734686941937664/sXvpT4vY_x96.jpg,https://twitter.com/PostSports/status/1682455416054206475,tweet_id:1682455416054206475
K Dubb,@TheReal_KDubb,2023-07-21T17:54:25.000Z,False,"Northwestern Football Assistant Accused of Witnessing Hazing, per Report https://si.com/college/2023/07/21/northwestern-football-assistant-accused-witnessing-hazing… #sports #feedly",0,0,0,59,"['#sports', '#feedly']",[],[],https://pbs.twimg.com/profile_images/1290427372869529600/6_kCtBFl_x96.jpg,https://twitter.com/TheReal_KDubb/status/1682448961997623301,tweet_id:1682448961997623301
Harry,@Harry48299960,2023-07-21T17:49:05.000Z,False,"Northwestern Football Assistant Accused of Witnessing Hazing, per Report",0,0,0,54,[],[],[],https://pbs.twimg.com/profile_images/1579570458755637248/psDmtZsM_x96.jpg,https://twitter.com/Harry48299960/status/1682447618180538368,tweet_id:1682447618180538368
Chicago Tribune,@chicagotribune,2023-07-21T21:00:11.000Z,False,"The day Northwestern University fired head football coach Pat Fitzgerald in response to the team’s hazing scandal, alums Jim Nugent and Vicki Olivera Nugent immediately decided to cancel their football season tickets and requested a refund in protest.",2,3,3,9.4K,[],[],[],https://pbs.twimg.com/profile_images/1542900856110055426/65co59gz_x96.jpg,https://twitter.com/chicagotribune/status/1682495709516382209,tweet_id:1682495709516382209
Mark P. Loftus,@markploftus,2023-07-21T19:55:02.000Z,False,"Northwestern football hazing: Northwestern hazing scandal could be biggest ever in college sports, attorney says - ABC7 Chicago https://abc7chicago.com/northwestern-football-hazing-scandal-locker-room/13530598/…",0,2,2,189,[],[],[],https://pbs.twimg.com/profile_images/985973006185844736/-nYfIJ3J_x96.jpg,https://twitter.com/markploftus/status/1682479314145538048,tweet_id:1682479314145538048
"Salvi, Schostok & Pritchard P.C.",@SalviLaw,2023-07-21T18:34:17.000Z,False,"Two additional former Northwestern University Football players have filed lawsuits against the University, ACC Commissioner James Phillips, former head coach Pat Fitzgerald, and other defendants for hazing-related allegations.",0,0,3,263,[],[],[],https://pbs.twimg.com/profile_images/1684299570971308033/Yk7_qH8A_x96.jpg,https://twitter.com/SalviLaw/status/1682458996362432514,tweet_id:1682458996362432514
Wednesday Journal,@OakPark,2023-07-21T18:30:20.000Z,False,"Oak Park and River Forest High School football alumnus Lloyd Yates, is among eight former Northwestern University football players who are planning a lawsuit against the school after recent revelations of hazing and racism.",0,2,0,859,[],[],[],https://pbs.twimg.com/profile_images/1554213551295840258/DTEhqW4j_x96.jpg,https://twitter.com/OakPark/status/1682458001871863809,tweet_id:1682458001871863809
Sun-Times Sports,@suntimes_sports,2023-07-21T21:01:12.000Z,False,"A third former football player at Northwestern has filed a lawsuit alleging the school fostered a culture of hazing and abuse. The former player, identified as John Doe 3, filed the suit in Cook County through his attorney Patrick Salvi Jr.",0,0,0,604,[],[],[],https://pbs.twimg.com/profile_images/978867358696726529/ZOciLJoA_x96.jpg,https://twitter.com/suntimes_sports/status/1682495968350969858,tweet_id:1682495968350969858
Larry Hawley,@HawleySports,2023-07-21T21:21:10.000Z,False,"Two weeks after the findings of an investigation into Northwestern football hazing allegations were released, a third lawsuit has been filed against the university and others associated with the program.
.
More on this on #WGNNewsNow from  here: https://tinyurl.com/5n8yf4y2",4,2,4,4.9K,['#WGNNewsNow'],['@WGNNews'],[],https://pbs.twimg.com/profile_images/1428461464461971461/P-RRJFzr_x96.jpg,https://twitter.com/HawleySports/status/1682500993089404929,tweet_id:1682500993089404929
The News & Observer,@newsobserver,2023-07-21T21:20:12.000Z,False,"After the hazing and mistreatment scandal at Northwestern, Duke football coach Mike Elko thinks his son has found a better situation.",0,0,1,1.6K,[],[],[],https://pbs.twimg.com/profile_images/1420801522980564998/DRBnn7xI_x96.jpg,https://twitter.com/newsobserver/status/1682500747303215105,tweet_id:1682500747303215105
The Charlotte Observer,@theobserver,2023-07-21T21:20:11.000Z,False,"After the hazing and mistreatment scandal at Northwestern, Duke football coach Mike Elko thinks his son has found a better situation.  https://charlotteobserver.com/sports/college/article277390993.html?taid=64baf68963691100018a38f6&utm_campaign=trueanthem&utm_medium=trueanthem&utm_source=twitter…",0,0,1,1.8K,[],[],[],https://pbs.twimg.com/profile_images/1420825348913180679/ard2TsAV_x96.jpg,https://twitter.com/theobserver/status/1682500742500831232,tweet_id:1682500742500831232
N&O Sports,@nandosports,2023-07-21T21:14:41.000Z,False,"After the hazing and mistreatment scandal at Northwestern, Duke football coach Mike Elko thinks his son has found a better situation.",0,0,1,309,[],[],[],https://pbs.twimg.com/profile_images/1100223377/nandosports_x96.png,https://twitter.com/nandosports/status/1682499360800620553,tweet_id:1682499360800620553
ACC Now,@accnow,2023-07-21T21:14:41.000Z,False,"After the hazing and mistreatment scandal at Northwestern, Duke football coach Mike Elko thinks his son has found a better situation.",0,0,3,517,[],[],[],https://pbs.twimg.com/profile_images/1166172775683428352/hwbI4dD__x96.jpg,https://twitter.com/accnow/status/1682499359756242944,tweet_id:1682499359756242944
Chicago Bob,@ChicagoBob10,2023-07-21T21:52:40.000Z,False,"Check out this Northwestern Athletics email graphic for their upcoming fall sports season that features athletes from volleyball, field hockey, and men’s and women’s soccer.

Notable omission: football (their largest revenue sport and current hazing scandal)",0,0,0,465,[],[],[],https://pbs.twimg.com/profile_images/1288287646557634560/64o7exaO_x96.jpg,https://twitter.com/ChicagoBob10/status/1682508917362905089,tweet_id:1682508917362905089
Quad-City Times,@qctimes,2023-07-22T10:45:02.000Z,False,"CHICAGO — The day Northwestern University fired head football coach Pat Fitzgerald in response to the team’s hazing scandal, alums Jim Nugent and Vicki Olivera Nugent immediately decided to cancel https://qctimes.com/sports/college/some-northwestern-football-fans-are-ditching-their-tickets-in-the-wake-of-the-hazing-scandal/article_103ad830-e0cb-55a4-989d-85c623477e8e.html?utm_campaign=snd-autopilot&utm_medium=social&utm_source=twitter_qctimes…",0,0,0,833,[],[],[],https://pbs.twimg.com/profile_images/821455944856977408/FoLwNa9H_x96.jpg,https://twitter.com/qctimes/status/1682703290516099072,tweet_id:1682703290516099072
Chicago Things to Do,@redeyechicago,2023-07-22T04:45:07.000Z,False,"How will Northwestern’s football hazing scandal affect the university long term? ""It’s a reputational issue.""",0,0,1,1.8K,[],[],[],https://pbs.twimg.com/profile_images/1284226688390488065/T7iHAAwi_x96.jpg,https://twitter.com/redeyechicago/status/1682612713975959552,tweet_id:1682612713975959552
Rock Hill Herald,@RHHerald,2023-07-21T22:00:41.000Z,False,"After the hazing and mistreatment scandal at Northwestern, Duke football coach Mike Elko thinks his son has found a better situation.",0,0,0,435,[],[],[],https://pbs.twimg.com/profile_images/1420825809686863872/BtgFQpS6_x96.jpg,https://twitter.com/RHHerald/status/1682510935255130112,tweet_id:1682510935255130112
The Washington Times,@WashTimes,2023-07-21T21:55:27.000Z,True,"Northwestern University is facing multiple lawsuits after allegations that the football program had a hazing problem for years, including ""forced participation, nudity and sexualized acts of a degrading nature.""",0,0,1,1K,[],[],[],https://pbs.twimg.com/profile_images/1604930970951507968/BVxIooAU_x96.jpg,https://twitter.com/WashTimes/status/1682509617647976449,tweet_id:1682509617647976449
SCMcGee Never Give Up On Hope,@McGee06708992,2023-07-22T14:52:27.000Z,False,"Some Northwestern football fans are ditching their tickets in the wake of the hazing scandal, firing of Fitzgerald https://rawstory.com/some-northwestern-football-fans-are-ditching-their-tickets-in-the-wake-of-the-hazing-scandal-firing-of-fitzgerald/…",0,0,0,76,[],[],[],https://pbs.twimg.com/profile_images/1602997917928853506/Qgzd0TTH_x96.jpg,https://twitter.com/McGee06708992/status/1682765556192104448,tweet_id:1682765556192104448
alias Rob Roy,@cidsports,2023-07-22T12:42:47.000Z,False,"Nicole Markus, Summer Editor in Chief, The Daily Northwestern, joins John Williams to talk about how they broke the bombshell Northwestern football hazing story that ultimately led to the university firing head football coach Pat Fitzgerald. #Hazing #CFB",0,0,0,228,"['#Hazing', '#CFB']",[],[],https://pbs.twimg.com/profile_images/1148427997088821248/GmMmYVQN_x96.jpg,https://twitter.com/cidsports/status/1682732923156418560,tweet_id:1682732923156418560
ChicMik,@ChyMik,2023-07-22T11:16:28.000Z,False,"Northwestern University’s degrading, appalling hazing…

Former Northwestern football players describe intense hazing",0,0,0,93,[],[],[],https://pbs.twimg.com/profile_images/1508814952273960975/ID-AnmG7_x96.jpg,https://twitter.com/ChyMik/status/1682711202747514880,tweet_id:1682711202747514880
All things St. Louis,@WeLoveSTL,2023-07-22T10:56:40.000Z,False,"Some Northwestern football fans are ditching their tickets in the wake of the hazing scandal, firing of Fitzgerald https://ift.tt/tpAUy2q #stlouis #sports",0,0,0,83,"['#stlouis', '#sports']",[],[],https://pbs.twimg.com/profile_images/818854792663441408/9Pv7XLaN_x96.jpg,https://twitter.com/WeLoveSTL/status/1682706218945503232,tweet_id:1682706218945503232
Tribune Sports Dept.,@FremontSports,2023-07-22T10:50:02.000Z,False,"CHICAGO — The day Northwestern University fired head football coach Pat Fitzgerald in response to the team’s hazing scandal, alums Jim Nugent and Vicki Olivera Nugent immediately decided to cancel https://fremonttribune.com/sports/college/some-northwestern-football-fans-are-ditching-their-tickets-in-the-wake-of-the-hazing-scandal/article_07a1b62e-5f71-54dd-a1db-213505a80ef9.html?utm_campaign=snd-autopilot&utm_medium=social&utm_source=twitter_FremontSports…",0,0,0,440,[],[],[],https://pbs.twimg.com/profile_images/996772716244942853/RKdjXVNC_x96.jpg,https://twitter.com/FremontSports/status/1682704549847375872,tweet_id:1682704549847375872
Reuters Legal,@ReutersLegal,2023-07-22T17:00:00.000Z,False,A lawsuit against Northwestern University and its fired head coach Patrick Fitzgerald over allegations of hazing in the school's football program has attracted a growing cadre of high-profile lawyers from Chicago and elsewhere https://reut.rs/3DnK0RI,1,5,4,2.2K,[],[],[],https://pbs.twimg.com/profile_images/877491866706395139/QnLtTu2w_x96.jpg,https://twitter.com/ReutersLegal/status/1682797655229956096,tweet_id:1682797655229956096
Dr Earl,@DrEarl9,2023-07-22T22:13:36.000Z,False,What a schmuck to avoid Northwestern football hazing. Suspicious. It feels like Greeny donated to gain admission for his kids- now has nothing to say. That’s weird from the ultimate loud mouth.,0,0,0,147,[],[],[],https://abs.twimg.com/sticky/default_profile_images/default_profile_x96.png,https://twitter.com/DrEarl9/status/1682876576273235968,tweet_id:1682876576273235968
Brandon Driver,@Sentient_Egg,2023-07-22T20:43:01.000Z,False,"Both involve football programs and hazing, although it looks like the Northwestern case took it to a crazy extreme",1,0,0,237,[],[],"['\\U0001f62c', '\\U0001f447']",https://pbs.twimg.com/profile_images/546451901655842816/LOcUe8Ag_x96.jpeg,https://twitter.com/Sentient_Egg/status/1682853778427371521,tweet_id:1682853778427371521
Meggirl003,@megj003,2023-07-22T18:26:52.000Z,False,So it’s interesting how they want to make a big deal out of FAMU (HBCU) for their incident & suspend entire football program but hide Northwestern bs with their perverted hazing & get a slap on the wrist for punishment. Smh,1,1,3,3.5K,[],[],[],https://pbs.twimg.com/profile_images/1574992767041912833/wQb9f076_x96.jpg,https://twitter.com/megj003/status/1682819516416380928,tweet_id:1682819516416380928
.,@IguanaSoup,2023-07-22T18:22:42.000Z,False,you know who might have trouble selling tickets? northwestern football. (due to the decades long sexual hazing in the program run by your friend of 27 years),0,0,9,620,[],[],[],https://pbs.twimg.com/profile_images/1496294243861684224/BM5BQUId_x96.jpg,https://twitter.com/IguanaSoup/status/1682818469102776321,tweet_id:1682818469102776321
Nate Holdren,@n_hold,2023-07-22T17:47:03.000Z,False,Stanford's and Texas A and M's presidents and Northwestern's football head coach all getting bounced in a few weeks feels like a lot of higher ed upper management scandal but idk for sure. Am I right that this is abnormal or am I just uninformed?,1,0,10,1K,[],[],[],https://pbs.twimg.com/profile_images/1364997531046928388/Cmm_UUNe_x96.jpg,https://twitter.com/n_hold/status/1682809495297171456,tweet_id:1682809495297171456
Marilyn #RoeVember #VoteBlue2024,@mlauriat,2023-07-22T17:23:03.000Z,False,"Some Northwestern football fans are ditching their tickets in the wake of the hazing scandal, firing of Fitzgerald https://rawstory.com/some-northwestern-football-fans-are-ditching-their-tickets-in-the-wake-of-the-hazing-scandal-firing-of-fitzgerald/…",0,0,1,131,[],[],[],https://pbs.twimg.com/profile_images/1369767561068306437/7r16jv-H_x96.jpg,https://twitter.com/mlauriat/status/1682803456808046593,tweet_id:1682803456808046593
ᖇᗝᗝᔕᗴᐯᗴᒪ丅 丅ᗴᖇᖇᎥᗴᖇᔕ,@RTerriers,2023-07-22T17:13:08.000Z,True,"4 more Northwestern football alums underwent 'ritualized sexual' hazing, they say
 ""We were thrown into a culture where physical, emotional and sexual abuse was normalized.""  Crump and his partner, Steve Levin, said they hope the scandal, which has rocked Northwestern, 
/",1,0,1,151,[],[],[],https://pbs.twimg.com/profile_images/1592641385332629507/pFz5R7pA_x96.jpg,https://twitter.com/RTerriers/status/1682800960622526465,tweet_id:1682800960622526465
