Name,Handle,Timestamp,Verified,Content,Comments,Retweets,Likes,Analytics,Tags,Mentions,Emojis,Profile Image,Tweet Link,Tweet ID
The Pantagraph,@Pantagraph,2023-08-14T18:33:03.000Z,False,"Rocked by a hazing scandal, Northwestern football hopes David Braun can help steady program. https://pantagraph.com/sports/college/football/northwestern-wildcats-david-braun-college-football-big-ten/article_2a469bb0-d8bf-5c7e-8123-3077b8f00047.html?utm_campaign=snd-autopilot&utm_medium=social&utm_source=twitter_Pantagraph…",0,1,0,382,[],[],[],https://pbs.twimg.com/profile_images/1476393786423103490/7vow4ymb_x96.jpg,https://twitter.com/Pantagraph/status/1691155992715649024,tweet_id:1691155992715649024
BruceZayne,@bruce_zayne,2023-08-14T16:11:15.000Z,False,How much of a loss should we expect Northwestern Football to take after the hazing scandal and firing of Pat Fitzgerald?,1,0,113,19K,[],[],[],https://pbs.twimg.com/profile_images/1736196250884526080/bmYkcz4z_x96.jpg,https://twitter.com/bruce_zayne/status/1691120308931993600,tweet_id:1691120308931993600
"Benny Fazio, Criminal Mastermind",@KButter_22,2023-08-14T15:43:19.000Z,False,How much of a loss should we expect Northwestern Football to take after the hazing scandal and firing of Pat Fitzgerald?,0,0,75,11K,[],[],[],https://pbs.twimg.com/profile_images/1624873001085804545/MCXGwA9P_x96.jpg,https://twitter.com/KButter_22/status/1691113279983394817,tweet_id:1691113279983394817
kiara,@kiaradidwhat,2023-08-14T02:33:21.000Z,False,Thanks Ryan! Listen to our episode on alleged hazing within Northwestern Football: https://lnk.bio/takeittogopod,0,0,1,117,[],[],"['\\U0001f49c', '\\U0001f3a7']",https://pbs.twimg.com/profile_images/1563353272911507456/NmM_k5Yo_x96.jpg,https://twitter.com/kiaradidwhat/status/1690914476889952256,tweet_id:1690914476889952256
Take It To-Go Podcast,@TakeItToGoPod,2023-08-13T20:21:41.000Z,False,We're two former NUFB student staffers who recorded a podcast about our time inside the Northwestern football program. We speak candidly about everything from the hazing allegations to the tee shirts. Hope it's informative for you and other Wildcat fans!,0,0,1,24,[],[],[],https://pbs.twimg.com/profile_images/1687124477631406081/3f_HA2jZ_x96.jpg,https://twitter.com/TakeItToGoPod/status/1690820943168311299,tweet_id:1690820943168311299
Big Ten Country,@NBCSBigTen,2023-08-13T18:18:43.000Z,False,"As Northwestern prepares for a football season under the clouds of a hazing investigation,  breaks down the Wildcats with   : http://trib.al/U3G7ipg: http://trib.al/mDHdVQR",0,3,2,6.9K,[],"['@Bradley_Locker', '@JamesNeveau']","['\\U0001f3a5', '\\U0001f3a7']",https://pbs.twimg.com/profile_images/1679159116969787392/R6McLdbJ_x96.jpg,https://twitter.com/NBCSBigTen/status/1690789999212384256,tweet_id:1690789999212384256
Chicago Tribune Sports,@ChicagoSports,2023-08-13T18:00:16.000Z,False,"What to know about the Northwestern football hazing scandal, as well as other issues in the athletic department and what’s next for the university.",1,1,0,1.6K,[],[],[],https://pbs.twimg.com/profile_images/1159866085379858432/Eg3rFEas_x96.jpg,https://twitter.com/ChicagoSports/status/1690785354545303552,tweet_id:1690785354545303552
Take It To-Go Podcast,@TakeItToGoPod,2023-08-11T23:12:44.000Z,False,Hazing? Racism? Did Fitz know? Two former Northwestern football student equipment managers are here to share a behind-the-scenes look at the scandal that rocked college athletics.https://lnk.bio/takeittogopod#northwesternuniversity #fridaymorning #podcast #hazing #football #BIG10,0,5,6,2K,"['#northwesternuniversity', '#fridaymorning', '#podcast', '#hazing', '#football', '#BIG10']",[],[],https://pbs.twimg.com/profile_images/1687124477631406081/3f_HA2jZ_x96.jpg,https://twitter.com/TakeItToGoPod/status/1690139214032039936,tweet_id:1690139214032039936
Dr Earl,@DrEarl9,2023-08-11T18:04:58.000Z,False,He must be talking Northwestern football hazing. That gets Greeny fired up to use his fame ymyo help people,0,0,0,69,[],[],[],https://abs.twimg.com/sticky/default_profile_images/default_profile_x96.png,https://twitter.com/DrEarl9/status/1690061761561423872,tweet_id:1690061761561423872
Pamela Taylor,@joshmom1,2023-08-11T17:26:21.000Z,False,Northwestern VP for Athletics denounced 'offensive' shirts worn by football staff that honored the school's old coach who was fired over allegations of hazing,0,0,0,73,[],[],[],https://pbs.twimg.com/profile_images/508104781051621376/E7Fb1EJk_x96.jpeg,https://twitter.com/joshmom1/status/1690052045661741056,tweet_id:1690052045661741056
Take It To-Go Podcast,@TakeItToGoPod,2023-08-11T17:18:45.000Z,False,"Hazing? Racism? What did Pat Fitzgerald know? Two former Northwestern football student staffers share a behind-the-scenes look at the scandal that rocked college athletics. Listen wherever you get podcasts

Spotify - https://open.spotify.com/episode/66R7K1uRJjfG3JlBzYiw26?si=c88qIL_BQlSpUv9SgLQs-g…Apple -",1,2,1,2.3K,[],[],['\\U0001f451'],https://pbs.twimg.com/profile_images/1687124477631406081/3f_HA2jZ_x96.jpg,https://twitter.com/TakeItToGoPod/status/1690050131993731081,tweet_id:1690050131993731081
iPERSiST - iRESiST - iM,@MRHW,2023-08-11T15:22:56.000Z,False,Northwestern VP for Athletics denounced 'offensive' shirts worn by football staff that honored the school's old coach who was fired over allegations of hazing,0,0,0,84,[],[],[],https://pbs.twimg.com/profile_images/1715832349617963008/TIxCBAqx_x96.jpg,https://twitter.com/MRHW/status/1690020984982810624,tweet_id:1690020984982810624
Law360,@Law360,2023-08-11T14:31:57.000Z,True,Northwestern University is facing a deluge of lawsuits after an internal investigation by ArentFox Schiff LLP released July 7 confirmed hazing activities and events within the football program. https://law360.com/articles/1709436…,0,1,2,936,[],[],[],https://pbs.twimg.com/profile_images/1651968748557856772/D-CmfORG_x96.png,https://twitter.com/Law360/status/1690008152631062528,tweet_id:1690008152631062528
Tony Stacks,@gamblingstacks,2023-08-11T12:49:07.000Z,False,Porkie Sundae sounds like a Northwestern football hazing ritual.,0,0,8,530,[],[],[],https://pbs.twimg.com/profile_images/1402510187068628992/0vUt33Ch_x96.jpg,https://twitter.com/gamblingstacks/status/1689982276610736128,tweet_id:1689982276610736128
StonedArtistPoet. On the streets....,@stormborn1966,2023-08-11T11:35:00.000Z,False,Northwestern VP for Athletics denounced 'offensive' shirts worn by football staff that honored the school's old coach who was fired over allegations of hazing,0,0,0,5,[],[],[],https://pbs.twimg.com/profile_images/1527539412552151040/iCxU8FUO_x96.jpg,https://twitter.com/stormborn1966/status/1689963623811002369,tweet_id:1689963623811002369
The Independent Singapore,@IndependentSG,2023-08-11T10:37:42.000Z,False,"Northwestern University officials and lawyers are criticizing a football coach for wearing a shirt with ""Cats Against The World"" in the midst of a hazing scandal.",0,0,0,135,[],[],[],https://pbs.twimg.com/profile_images/730383108000731136/uG-He7qj_x96.jpg,https://twitter.com/IndependentSG/status/1689949203584208896,tweet_id:1689949203584208896
Neil Dixon,@NeilDix22561579,2023-08-11T02:30:45.000Z,False,Northwestern VP for Athletics denounced 'offensive' shirts worn by football staff that honored the school's old coach who was fired over allegations of hazing https://msn.com/en-us/sports/nfl/northwestern-vp-for-athletics-denounced-offensive-shirts-worn-by-football-staff-that-honored-the-school-s-old-coach-who-was-fired-over-allegations-of-hazing/ar-AA1f6wKV?ocid=socialshare&pc=U531&cvid=ef7079d9586a487a940634e283fb9cfc&ei=45…   Nothing like self destruction.,1,0,0,86,[],[],[],https://pbs.twimg.com/profile_images/1653031721787375616/r2HJdNnu_x96.jpg,https://twitter.com/NeilDix22561579/status/1689826658339975168,tweet_id:1689826658339975168
@theLadyArcher77,@theLadyArcher77,2023-08-11T00:45:30.000Z,False,Northwestern VP for Athletics denounced 'offensive' shirts worn by football staff that honored the school's old coach who was fired over allegations of hazing,1,0,0,95,[],[],[],https://pbs.twimg.com/profile_images/1345062204593242113/PD-shuC__x96.jpg,https://twitter.com/TheLadyArcher77/status/1689800171444719616,tweet_id:1689800171444719616
Bryant Anderson,@qltwabd,2023-08-11T00:15:52.000Z,False,Northwestern VP for Athletics denounced 'offensive' shirts worn by football staff that honored the school's old coach who was fired over allegations of hazing,0,0,0,81,[],[],[],https://pbs.twimg.com/profile_images/1590322224/profile_picture_x96.jpg,https://twitter.com/qltwabd/status/1689792713367920640,tweet_id:1689792713367920640
Jose Rodriguez,@esoj1211,2023-08-10T23:08:41.000Z,False,"It's part of a planned cull...why did so many years pass between the actual hazing incidents and the destabilization of Northwestern?  Watch some BS engulf IU, PU and UIUC football.",0,0,1,137,[],[],[],https://pbs.twimg.com/profile_images/578371277057966080/McgUclfu_x96.jpeg,https://twitter.com/esoj1211/status/1689775807302942720,tweet_id:1689775807302942720
People,@people,2023-08-10T22:08:11.000Z,True,"Northwestern Football Staff, Players Slammed for ‘Inappropriate' Shirts amid Hazing Scandal",2,1,11,18K,[],[],[],https://pbs.twimg.com/profile_images/703345483218067456/waTSntUG_x96.jpg,https://twitter.com/people/status/1689760583044734978,tweet_id:1689760583044734978
NewsOnePlace.com,@newsoneplace,2023-08-10T19:28:08.000Z,False,(Insider):#Northwestern VP for #Athletics denounced 'offensive' shirts worn by football staff that honored the school's old coach who was fired over allegations of hazing : Northwestern VP for Athletics and Recreation Derrick ..,0,0,0,10,"['#Northwestern', '#Athletics']",[],[],https://pbs.twimg.com/profile_images/1393992289446412290/YHcCY0t3_x96.jpg,https://twitter.com/newsoneplace/status/1689720304463970304,tweet_id:1689720304463970304
Insider Sports,@SportsInsider,2023-08-10T19:06:37.000Z,False,Northwestern VP for Athletics denounced 'offensive' shirts worn by football staff that honored the school's old coach who was fired over allegations of hazing,0,0,0,415,[],[],[],https://pbs.twimg.com/profile_images/1605219264994082816/nJ6IpuO9_x96.jpg,https://twitter.com/SportsInsider/status/1689714887994286080,tweet_id:1689714887994286080
Becca Cohen,@beccamcohen,2023-08-10T18:52:22.000Z,False,Northwestern VP for Athletics denounced 'offensive' shirts worn by football staff that honored the school's old coach who was fired over allegations of hazing,0,0,0,148,[],[],[],https://pbs.twimg.com/profile_images/1488001185399414784/4V_kgu4z_x96.jpg,https://twitter.com/beccamcohen/status/1689711303554719744,tweet_id:1689711303554719744
Jerry Swon NJ,@jerryeswon,2023-08-10T18:48:12.000Z,False,Northwestern VP for Athletics denounced 'offensive' shirts worn by football staff that honored the school's old coach who was fired over allegations of hazing,0,0,0,91,[],[],[],https://pbs.twimg.com/profile_images/968860661064216576/GdvgNxcj_x96.jpg,https://twitter.com/jerryeswon/status/1689710252067811329,tweet_id:1689710252067811329
Campus Circle,@CampusCircle,2023-08-10T16:47:08.000Z,False,Continued dissappointment out of #Northwestern. (1) FireCoach (2) Sanction players who wore these shirts (3) Unionize CollegeSports 2protect athletes-  #Northwestern denounces football staffers for ‘tone deaf’ shirts worn at practice amid hazing lawsuits -https://cnn.com/2023/08/10/sport/northwestern-hazing-scandal-football-spt-intl…,1,0,0,162,"['#Northwestern', '#Northwestern']",[],[],https://pbs.twimg.com/profile_images/459772915894845441/hECeKdGS_x96.jpeg,https://twitter.com/CampusCircle/status/1689679787114233856,tweet_id:1689679787114233856
sylvaner,@Sylvaners,2023-08-10T16:31:45.000Z,False,Northwestern Football Players' Controversial T-Shirts in Honor of Fitzgerald Lead to Outrage In Midst of Hazing Scandal,1,0,0,71,[],[],[],https://pbs.twimg.com/profile_images/378800000407162470/d02ba046cab379f5a8298478a62aabb3_x96.jpeg,https://twitter.com/Sylvaners/status/1689675916773892096,tweet_id:1689675916773892096
Paula Duffy,@jurisdiva,2023-08-10T15:56:57.000Z,False,"""In the first fall practice open to media, a few Northwestern football coaches wore shirts that read 'Cats against the World'""
There are sexually abused young men out there still dealing with the ""hazing"".",2,0,1,152,[],[],[],https://pbs.twimg.com/profile_images/1624532286598451200/1oif0-QY_x96.jpg,https://twitter.com/jurisdiva/status/1689667158526308353,tweet_id:1689667158526308353
Brett Akagi,@bakagi,2023-08-10T15:41:08.000Z,False,Northwestern football coaches wear 'Cats Against The World' T-shirts amid hazing scandal https://usatoday.com/story/sports/ncaaf/2023/08/09/northwestern-football-coaches-wear-cats-against-the-world-t-shirts/70560988007/… via ,1,0,0,113,[],['@USATODAY'],[],https://pbs.twimg.com/profile_images/1720237385823186944/Jxo1KCD2_x96.jpg,https://twitter.com/bakagi/status/1689663175103225856,tweet_id:1689663175103225856
The New York Times,@nytimes,2023-08-10T14:40:07.000Z,True,"From : Northwestern athletic director Derrick Gragg called out the “inappropriate, offensive and tone deaf” Pat Fitzgerald shirts football staffers wore to practice on Wednesday despite a hazing scandal that resulted in the head coach's firing.",16,21,64,141K,[],['@TheAthletic'],[],https://pbs.twimg.com/profile_images/1098244578472280064/gjkVMelR_x96.png,https://twitter.com/nytimes/status/1689647820293439488,tweet_id:1689647820293439488
Topher Choate,@TopherChoate,2023-08-10T14:36:28.000Z,False,This is one half of one of the hazing rituals that got the football coach fired at Northwestern.,0,0,0,1,[],[],[],https://abs.twimg.com/sticky/default_profile_images/default_profile_x96.png,https://twitter.com/TopherChoate/status/1689646905268256774,tweet_id:1689646905268256774
Tanstaafler,@tanstaafler,2023-08-10T13:50:42.000Z,False,Northwestern hazing scandal: University criticizes ‘tone deaf’ shirts worn at football practice amid hazing lawsuits | CNN https://cnn.com/2023/08/10/sport/northwestern-hazing-scandal-football-spt-intl/index.html…,1,1,1,66,[],[],[],https://pbs.twimg.com/profile_images/1045854156269981696/OM-x1_sg_x96.jpg,https://twitter.com/tanstaafler/status/1689635385067044864,tweet_id:1689635385067044864
Mirrors %Image,@MirrorsI94833,2023-08-10T13:35:28.000Z,False,Northwestern denounces football staffers for ‘tone deaf’ shirts worn at practice amid hazing lawsuitshttps://cnn.com/2023/08/10/sport/northwestern-hazing-scandal-football-spt-intl…,1,0,1,40,[],[],[],https://pbs.twimg.com/profile_images/1686721869737598976/RGrcgmJ2_x96.jpg,https://twitter.com/MirrorsI94833/status/1689631552286707712,tweet_id:1689631552286707712
The End of Sport (@endofsportpod.bsky.social),The End of Sport (@endofsportpod.bsky.social),2023-08-10T13:01:50.000Z,False,Check out  and  in  on how the research conducted for *The End of College Football* ( 2024) helps us understand Northwestern and hazing and harm in college football.https://amp.theguardian.com/sport/2023/jul/11/northwestern-hazing-scandal-toxic-culture-pat-fitzgerald…,0,1,1,233,[],"['@nkalamb', '@Derekcrim', '@guardian_sport', '@UNC_Press']",[],https://pbs.twimg.com/profile_images/1249425327048347649/6uW9n5uI_x96.jpg,https://twitter.com/EndofSportPod/status/1689623089150091264,tweet_id:1689623089150091264
Jeff Greenberg,@jeffgberg,2023-08-10T12:23:58.000Z,False,Here is an example of what  was saying. It appears that the Northwestern admin would love to use this scandal to eliminate their football program. Small hints have bigger meanings.,0,0,2,277,[],['@wesbury'],[],https://pbs.twimg.com/profile_images/1275125984430379009/qo-hIp0h_x96.jpg,https://twitter.com/jeffgberg/status/1689613557841719296,tweet_id:1689613557841719296
Star Tribune Sports,@StribSports,2023-08-10T00:27:00.000Z,True,"Northwestern AD Derrick Gragg criticized staffers for wearing shirts supporting fired football coach Pat Fitzgerald at practice, calling them ''inappropriate, offensive and tone deaf'' given the recent hazing and abuse scandal.https://startribune.com/northwestern-athletic-director-blasts-football-staffers-for-tone-deaf-shirts-supporting-fitzgerald/600295973/…",2,1,0,3K,[],[],[],https://pbs.twimg.com/profile_images/1168980343686356992/a1nNf0Fr_x96.png,https://twitter.com/StribSports/status/1689433126743769088,tweet_id:1689433126743769088
ABC 7 Chicago,@ABC7Chicago,2023-08-09T22:50:13.000Z,True,Current Northwestern football players addressed the media Wednesday after practice for the first time since the school's athletic program hazing investigation began.,0,0,0,3.9K,[],[],[],https://pbs.twimg.com/profile_images/1095472008127627265/9q9RSasl_x96.png,https://twitter.com/ABC7Chicago/status/1689408772635033600,tweet_id:1689408772635033600
ChicagoMediaX,@chicagomediaX,2023-08-09T22:44:35.000Z,False,Northwestern hazing scandal: Current players speak out for first time after football practice,0,0,0,73,[],[],[],https://pbs.twimg.com/profile_images/1305591215749029889/cHyOlSQA_x96.jpg,https://twitter.com/chicagomediaX/status/1689407354167820290,tweet_id:1689407354167820290
8 Man Rotation,@8ManRotation,2023-08-09T22:17:14.000Z,False,"Northwestern football coaches doubling down in the aftermath of their hazing scandal.

Absolutely no organizational or institutional control being shown.",0,0,0,133,[],[],[],https://pbs.twimg.com/profile_images/1718771092813123585/3YCRVpGi_x96.png,https://twitter.com/8ManRotation/status/1689400473051107328,tweet_id:1689400473051107328
WashTimes Sports,@WashTimesSports,2023-08-09T21:10:57.000Z,True,"Northwestern athletic director Derrick Gragg blasted assistant football coaches and staff members for wearing shirts supporting fired coach Pat Fitzgerald at practice Wednesday, calling them ""inappropriate, offensive and tone deaf"" given the hazing and...",1,1,0,272,[],[],[],https://pbs.twimg.com/profile_images/1752058359287623680/-wLArQNL_x96.png,https://twitter.com/WashTimesSports/status/1689383791347834880,tweet_id:1689383791347834880
jeffmetcalfe,@jeffmetcalfe,2023-08-09T21:07:49.000Z,False,Northwestern football coaches wear 'Cats Against The World' T-shirts amid hazing scandal https://usatoday.com/story/sports/ncaaf/2023/08/09/northwestern-football-coaches-wear-cats-against-the-world-t-shirts/70560988007/… via ,0,0,1,382,[],['@usatoday'],[],https://pbs.twimg.com/profile_images/1577085504910020608/SfQKGLmj_x96.jpg,https://twitter.com/jeffmetcalfe/status/1689383001170345990,tweet_id:1689383001170345990
AP Top 25,@AP_Top25,2023-08-09T20:38:13.000Z,False,"Northwestern AD Derrick Gragg blasted football staffers for wearing shirts supporting fired coach Pat Fitzgerald at practice Wednesday, calling them “inappropriate, offensive and tone deaf” given the hazing and abuse scandal engulfing the school.",15,58,87,129K,[],[],[],https://pbs.twimg.com/profile_images/1169715224183791616/0DCEthYH_x96.jpg,https://twitter.com/AP_Top25/status/1689375553575391232,tweet_id:1689375553575391232
Jerry Brockmeyer,@JerryBrockmeyer,2023-08-09T20:28:15.000Z,False,"Re the Northwestern's AD's comment against the football coaches wearing  shirts supporting Pat Fitzgerald and saying that hazing has no place at Northwestern, I do not think there is a place there for him either. He must ""know"" someone and that's how he got his job",0,0,0,89,[],[],[],https://pbs.twimg.com/profile_images/1562959833334067200/zLNbZWW-_x96.png,https://twitter.com/JerryBrockmeyer/status/1689373042923941889,tweet_id:1689373042923941889
Salty Sarsparilla,@SaltySarsparill,2023-08-09T20:21:14.000Z,False,"If there’s a scandal at a company, the CEO often gets fired even if he didn’t know about it. Because he should have known about it. See Northwestern football for a perfect example. Pat Fitzgerald was fired even though he didn’t know about the hazing, because he should have.",1,0,0,145,[],[],[],https://pbs.twimg.com/profile_images/1579191367682723840/FUc8M3uk_x96.jpg,https://twitter.com/SaltySarsparill/status/1689371280368144384,tweet_id:1689371280368144384
Crain's Chicago Business,@CrainsChicago,2023-08-09T19:27:35.000Z,False,Northwestern football players express sympathy for coach in wake of hazing scandal,0,1,1,2.5K,[],[],[],https://pbs.twimg.com/profile_images/1645898795266236417/-d1JXpXZ_x96.jpg,https://twitter.com/CrainsChicago/status/1689357778765172737,tweet_id:1689357778765172737
Kalyn Kahler,@kalynkahler,2023-08-09T19:26:42.000Z,False,"To recap today in northwestern football: the players won’t speak about hazing allegations, and repeatedly declined to comment, while staffers commented with their apparel",2,2,26,5.6K,[],[],[],https://pbs.twimg.com/profile_images/1313518411411083266/BLxcQ1ZU_x96.jpg,https://twitter.com/kalynkahler/status/1689357552968994816,tweet_id:1689357552968994816
B1G Dawg’s Winners,@bigdawgwinners,2023-08-09T19:24:24.000Z,False,"Darrel- as the ring leader of the Northwestern Football hazing, do you have a comment for the victims?",2,2,58,2.7K,[],[],[],https://pbs.twimg.com/profile_images/1536804893087911936/9Wo3cooT_x96.jpg,https://twitter.com/bigdawgwinners/status/1689356976608669697,tweet_id:1689356976608669697
RJ,@H4Llrj,2023-08-09T19:20:28.000Z,False,Somewhat nasty hazing scandal in the Northwestern football program. Mismanaged at all levels and ended w the head coach gettin axed. Now the coaches who used to work under the fired one are playing the “us vs the world” gimmick,0,0,2,138,[],[],[],https://pbs.twimg.com/profile_images/1428205869691404292/UOfAX05Z_x96.jpg,https://twitter.com/H4Llrj/status/1689355985507463168,tweet_id:1689355985507463168
Aaron Morse,@MorseCode206,2023-08-09T18:19:06.000Z,False,The correct answer is: “We all condemn hazing and we want to be leaders at Northwestern when it comes to putting an end to this very common practice in college football. It starts with us. Go Cats.”,0,0,1,160,[],[],[],https://pbs.twimg.com/profile_images/685120901189361664/KImZewyV_x96.jpg,https://twitter.com/MorseCode206/status/1689340541140426752,tweet_id:1689340541140426752
RachaelsFirstWeek,@Rachaels1Week,2023-08-08T15:00:16.000Z,False,Northwestern football coach fired amid revelations of homophobic & abusive hazing rituals https://bit.ly/3QsjVsq #Northwestern #hazing #athletes #football #collegesafety,0,0,0,137,"['#Northwestern', '#hazing', '#athletes', '#football', '#collegesafety']",[],[],https://pbs.twimg.com/profile_images/1312068404824739847/kBWw28rR_x96.jpg,https://twitter.com/Rachaels1Week/status/1688928117031841794,tweet_id:1688928117031841794
Cole Reynolds,@charcole27,2023-08-08T05:25:59.000Z,False,"Spoke to two former Northwestern football players about a pattern of hazing incidents in the mid-to-late 2000s. One of them said former head coach Pat Fitzgerald intervened and stopped the practice. 

More to come in the morning for ",2,6,36,14K,[],['@thedailynu'],[],https://pbs.twimg.com/profile_images/1679642437441015809/ji2049Eg_x96.jpg,https://twitter.com/charcole27/status/1688783595132051457,tweet_id:1688783595132051457
Antonio M. Romanucci,@TonyRomanucci,2023-08-07T17:46:28.000Z,False,"and current Northwestern football litigation. The editorial infers that the recent, disturbing allegations of hazing in Northwestern University's football program have raised awareness of this prevalent practice, but challenges high school sports programs",1,0,0,120,[],[],[],https://pbs.twimg.com/profile_images/1610299597661917184/yEzCckrX_x96.jpg,https://twitter.com/TonyRomanucci/status/1688607552987176960,tweet_id:1688607552987176960
Greg Luzinski's Roof Shot,@greg_shot,2023-08-07T16:43:07.000Z,False,Hope you asked him how much he loves football hazing at Northwestern!,0,0,0,135,[],[],[],https://pbs.twimg.com/profile_images/1309332158243393536/LW21XZPY_x96.jpg,https://twitter.com/greg_shot/status/1688591612878749696,tweet_id:1688591612878749696
Vox Optima,@VoxOptima,2023-08-07T16:15:12.000Z,False,#Crisiscomms lessons from the Northwestern football scandal by Tom Corfman | https://ow.ly/UXvz50PsOUC via  #crisiscommunication,0,0,0,52,"['#Crisiscomms', '#crisiscommunication']",['@PRDaily'],[],https://pbs.twimg.com/profile_images/378800000620249722/e5e3592fea7cd312f9a96ff4abdeb2cf_x96.jpeg,https://twitter.com/VoxOptima/status/1688584584714199040,tweet_id:1688584584714199040
Scott Servilla,@scstse,2023-08-07T13:17:47.000Z,False,", a Northwestern alum- a competitive nightmare and salacious scandals?  The historical record of NW football is horrific until Fitzgerald was hired. How did that end? A salacious scandal and 4-20 and 2-8 B1G the past two seasons.  Comical lack of self-awareness.",1,1,30,1.1K,[],['@slmandel'],[],https://pbs.twimg.com/profile_images/1045093299588141056/hwfhk3ZF_x96.jpg,https://twitter.com/scstse/status/1688539936733958144,tweet_id:1688539936733958144
The DL Hughley Show,@DLHughleyRadio,2023-08-07T12:56:43.000Z,False,Black Northwestern Football Players Claim Racial Hazing,1,5,2,519,[],[],[],https://pbs.twimg.com/profile_images/880067738764365824/p1wLmrOz_x96.jpg,https://twitter.com/DLHughleyRadio/status/1688534636694065153,tweet_id:1688534636694065153
Nate's Fortunate Son,@NatesFortunate1,2023-08-06T21:26:04.000Z,False, It seems the Northwestern hazing fiasco is not over. A new lawsuit has been filed claiming the football team had forced freshman John Doe to watch a continuous loop of all 85 episodes of The Magic Hour talk show with Magic Johnson as cruel and inhuman punishment.,0,0,1,182,[],['@BruceWolfChi'],[],https://pbs.twimg.com/profile_images/1409573171498528770/u_Rs5Qse_x96.jpg,https://twitter.com/NatesFortunate1/status/1688300429409398784,tweet_id:1688300429409398784
106.7 WTLC,@1067WTLC,2023-08-06T05:37:07.000Z,False,Black Northwestern Football Players Claim Racial Hazing,0,0,0,78,[],[],[],https://pbs.twimg.com/profile_images/1190259520678875142/bGvft1T8_x96.jpg,https://twitter.com/1067WTLC/status/1688061618796613633,tweet_id:1688061618796613633
