Name,Handle,Timestamp,Verified,Content,Comments,Retweets,Likes,Analytics,Tags,Mentions,Emojis,Profile Image,Tweet Link,Tweet ID
Richmond Times-Dispatch,@RTDNEWS,2023-07-27T12:20:02.000Z,True,"For ACC football coaches at this week’s conference media days in Charlotte, including Virginia’s Tony Elliott and Virginia Tech’s Brent Pry, the Northwestern hazing scandal and fallout have been a",0,1,1,931,[],[],[],https://pbs.twimg.com/profile_images/609446079214452736/ggUwXDMz_x96.jpg,https://twitter.com/RTDNEWS/status/1684539138794459136,tweet_id:1684539138794459136
RTD Sports,@RTDSports,2023-07-27T12:19:02.000Z,False,"For ACC football coaches at this week’s conference media days in Charlotte, including Virginia’s Tony Elliott and Virginia Tech’s Brent Pry, the Northwestern hazing scandal and fallout have been a",0,0,0,354,[],[],[],https://pbs.twimg.com/profile_images/609393668328263680/0S2iUmQ6_x96.jpg,https://twitter.com/RTDSports/status/1684538886318436353,tweet_id:1684538886318436353
USA TODAY Sports,@usatodaysports,2023-07-27T12:09:02.000Z,False,Former Northwestern football player's lawsuit has fueled discussion among hazing experts about whether perpetrators can be considered victims.,1,0,0,3.4K,[],[],[],https://pbs.twimg.com/profile_images/924985978711707648/IChoF1Bp_x96.jpg,https://twitter.com/usatodaysports/status/1684536371841585152,tweet_id:1684536371841585152
Mike's Job List,@MikesJoblist,2023-07-27T11:40:24.000Z,False,"What Peter Skoronski said about Northwestern football hazing allegations, Pat Fitzgerald firing https://sports.yahoo.com/peter-skoronski-said-northwestern-football-174438008.html?soc_src=social-sh&soc_trk=tw&tsrc=twtr… via ",0,0,0,165,[],['@YahooSports'],[],https://pbs.twimg.com/profile_images/1546520333485838338/3df2JUd8_x96.jpg,https://twitter.com/MikesJoblist/status/1684529163045142528,tweet_id:1684529163045142528
My2centworth,@my2centworth,2023-07-27T10:55:58.000Z,False,"American Educational ""System"". #bencrump #Northwestern #BlackLivesMatter #BlackTwitter 
Former Northwestern football players detail years of hazing, abuse in pr... https://youtu.be/vSSzLXr03Y8 via ",0,0,0,69,"['#bencrump', '#Northwestern', '#BlackLivesMatter', '#BlackTwitter']",['@YouTube'],[],https://pbs.twimg.com/profile_images/460400988516401152/vELsLSjg_x96.jpeg,https://twitter.com/my2centworth/status/1684517984012730368,tweet_id:1684517984012730368
Chicago Things to Do,@redeyechicago,2023-07-27T04:45:04.000Z,False,"Fallout at Northwestern: What to know about the football hazing scandal, firing of Pat Fitzgerald — and what’s next for the university",0,0,0,1.6K,[],[],[],https://pbs.twimg.com/profile_images/1284226688390488065/T7iHAAwi_x96.jpg,https://twitter.com/redeyechicago/status/1684424641840910338,tweet_id:1684424641840910338
Chicago Things to Do,@redeyechicago,2023-07-27T04:00:27.000Z,False,"Some Northwestern football fans are ditching their tickets in the wake of the hazing scandal, firing of Fitzgerald.  has more",2,0,1,2.4K,[],['@angie_leventis'],[],https://pbs.twimg.com/profile_images/1284226688390488065/T7iHAAwi_x96.jpg,https://twitter.com/redeyechicago/status/1684413413726867456,tweet_id:1684413413726867456
MSN Sports,@MSNSports,2023-07-27T03:20:29.000Z,False,"Northwestern's Interim Football coach, David Braun, addressed reporters at the Big Ten's annual football kickoff amid a litany of questions about what happened, how hazing became so pervasive and what, if anything, could be done to fix the system. (Julyhttps://msft.it/601296Z9K",0,0,0,108,[],[],[],https://pbs.twimg.com/profile_images/507911736662298625/bUC9Vb_A_x96.jpeg,https://twitter.com/MSNSports/status/1684403357543276545,tweet_id:1684403357543276545
CNN,@CNN,2023-07-27T02:30:16.000Z,True,"Northwestern University interim head football coach David Braun declined Wednesday to address reporters questions about the hazing allegations in the university’s athletic program, saying he trusts the school will choose the right path forward. https://cnn.it/3KdWNtu",11,20,70,157K,[],[],[],https://pbs.twimg.com/profile_images/1669780523911110656/K9gaaM1g_x96.jpg,https://twitter.com/CNN/status/1684390717928394752,tweet_id:1684390717928394752
Chicago Tribune Sports,@ChicagoSports,2023-07-27T01:30:04.000Z,False,"“Let me be clear, this football team will be ready to go.”Northwestern interim coach David Braun on Wednesday dodged questions about the hazing scandal that has rocked the university, instead talking about his players and the ""adversity"" they face.",0,2,0,2.4K,[],[],[],https://pbs.twimg.com/profile_images/1159866085379858432/Eg3rFEas_x96.jpg,https://twitter.com/ChicagoSports/status/1684375568219795461,tweet_id:1684375568219795461
KETV NewsWatch 7,@KETV,2023-07-27T00:28:03.000Z,False,"Big Ten Media Days: Northwestern HC addresses hazing scandal, Iowa's Ferentz focuses on football",0,0,1,2.8K,[],[],[],https://pbs.twimg.com/profile_images/875442270924832770/ZNJxEiEh_x96.jpg,https://twitter.com/KETV/status/1684359960333877249,tweet_id:1684359960333877249
Erie News Now,@ErieNewsNow,2023-07-27T00:21:03.000Z,False,Northwestern interim football coach declines to address hazing allegations at Big Ten media day https://erienewsnow.com/story/49266241/northwestern-interim-football-coach-declines-to-address-hazing-allegations-at-big-ten-media-day…,1,0,0,484,[],[],[],https://pbs.twimg.com/profile_images/1007875862539235328/ALse5zKK_x96.jpg,https://twitter.com/ErieNewsNow/status/1684358200332546053,tweet_id:1684358200332546053
David Jesse,@reporterdavidj,2023-07-27T00:14:02.000Z,False,"Northwestern University athletic director Derrick Gragg was out of the country as a hazing scandal spiraled in the football program. Here, from him, is what happened next and why he was on Zoom to tell the football team their coach had been fired.",0,2,3,1.2K,[],[],[],https://pbs.twimg.com/profile_images/1641444416014671879/Qircl_iO_x96.jpg,https://twitter.com/reporterdavidj/status/1684356433679089666,tweet_id:1684356433679089666
Fox News,@FoxNews,2023-07-26T23:05:02.000Z,True,Northwestern football players to skip Big Ten Media Days amid hazing scandal fallout,32,5,18,62K,[],[],[],https://pbs.twimg.com/profile_images/1591278197844414464/O6Fp0hFB_x96.jpg,https://twitter.com/FoxNews/status/1684339071521357824,tweet_id:1684339071521357824
Sun-Times Sports,@suntimes_sports,2023-07-26T22:51:49.000Z,False,Interim football coach David Braun did not directly address the Northwestern hazing scandal during his appearance at Big Ten Media Days.,1,0,0,637,[],[],[],https://pbs.twimg.com/profile_images/978867358696726529/ZOciLJoA_x96.jpg,https://twitter.com/suntimes_sports/status/1684335745513709568,tweet_id:1684335745513709568
Kenny Sommer,@edgerkjs,2023-07-26T22:30:44.000Z,False,"#ChicagoBears invest  n have a lot of hope Cole Kamet will be a pro bowl Tight End. Do hope the groovy local guy reaches that level this year @ 4 years $50 Million. Greg Olsen Like?! I'm a fan of #Northwestern football. Players not going to media day, scandal hurts team potential",0,0,0,135,"['#ChicagoBears', '#Northwestern']",[],[],https://pbs.twimg.com/profile_images/1458169896072892426/iikK-59G_x96.jpg,https://twitter.com/edgerkjs/status/1684330439396261890,tweet_id:1684330439396261890
Daily Herald,@dailyherald,2023-07-26T22:09:34.000Z,False,"Northwestern interim football coach, AD Gragg decline to address hazing allegations at Big Ten media day",0,0,0,1K,[],[],[],https://pbs.twimg.com/profile_images/854397424730873856/Eq8uhLy7_x96.jpg,https://twitter.com/dailyherald/status/1684325113515368450,tweet_id:1684325113515368450
Diverse: Issues In Higher Education,@DiverseIssues,2023-07-26T21:33:00.000Z,False,The volleyball player is Northwestern's () first female athlete to come forward amid the hazing scandal currently surrounding the school's football program.,1,0,1,371,[],['@northwesternu'],[],https://pbs.twimg.com/profile_images/1744808658158931969/iX4YIKS5_x96.jpg,https://twitter.com/DiverseIssues/status/1684315910662766596,tweet_id:1684315910662766596
Chicago Tribune Sports,@ChicagoSports,2023-07-26T21:30:14.000Z,False,"A judge rejected Evanston's request to prevent a local committee from discussing Northwestern’s proposed new football stadium.

Opponents have called for the school to postpone its plans while it addresses the hazing scandal in its athletic programs.",0,0,2,1.4K,[],[],[],https://pbs.twimg.com/profile_images/1159866085379858432/Eg3rFEas_x96.jpg,https://twitter.com/ChicagoSports/status/1684315212525064193,tweet_id:1684315212525064193
AP Sports,@AP_Sports,2023-07-26T20:45:00.000Z,True,"Northwestern Interim coach David Braun comments on the future of the school's football program, just a few weeks after Pat Fitzgerald’s firing for hazing. http://apne.ws/5jwROkB",2,4,4,7.9K,[],[],[],https://pbs.twimg.com/profile_images/2249747844/160X160_LOGO_x96.JPG,https://twitter.com/AP_Sports/status/1684303828416622592,tweet_id:1684303828416622592
JoeL,@JoelN901,2023-07-26T20:37:08.000Z,False,https://sports.yahoo.com/northwesterns-david-braun-thrust-into-uncomfortable-spotlight-at-big-ten-media-days-173728627.html…David Braun is serving as Northwestern's interim head coach after Pat Fitzgerald was fired following an investigation into hazing in the football program.,1,0,0,110,[],[],[],https://pbs.twimg.com/profile_images/1623823642990637057/73707YAs_x96.jpg,https://twitter.com/JoelN901/status/1684301851770908673,tweet_id:1684301851770908673
Cory W,@agent3881,2023-07-26T19:46:43.000Z,False,"“But when news broke earlier this month that Northwestern players alleged a toxic hazing culture within the school’s football program that led to the ouster of head coach Pat Fitzgerald, Hsu hoped it’d lead to a reexamination of Minnesota’s athletic department.”",0,0,0,354,[],[],[],https://pbs.twimg.com/profile_images/638315754/7816_983900084320_13902670_57156529_4054880_n_x96.jpg,https://twitter.com/agent3881/status/1684289161354682368,tweet_id:1684289161354682368
IL Sports Network,@ILSportsNetwork,2023-07-26T19:43:01.000Z,False,Northwestern interim coach David Braun says football team will overcome ‘adversity’ — but fails to address hazing allegations,0,0,1,106,[],[],[],https://pbs.twimg.com/profile_images/1120513231192297473/2kyUHcHI_x96.png,https://twitter.com/ILSportsNetwork/status/1684288232450662400,tweet_id:1684288232450662400
FOX 32 News,@fox32news,2023-07-26T19:40:16.000Z,True,Northwestern's hazing scandal already has cost the university its winningest football coach and a once-pristine reputation.,0,1,3,1.1K,[],[],[],https://pbs.twimg.com/profile_images/1737125022655778816/UIEtvKKk_x96.jpg,https://twitter.com/fox32news/status/1684287539710947329,tweet_id:1684287539710947329
Chicago Breaking News,@ChicagoBreaking,2023-07-26T19:28:13.000Z,False,Northwestern interim coach David Braun says football team will overcome ‘adversity’ — but fails to address hazing allegations,2,2,1,3.2K,[],[],[],https://pbs.twimg.com/profile_images/1283891088487587840/uAT3yCoa_x96.jpg,https://twitter.com/ChicagoBreaking/status/1684284506918756353,tweet_id:1684284506918756353
St. Louis Business Journal,@stlouisbiz,2023-07-26T19:01:16.000Z,False,The lawsuit is the first with a named plaintiff amid mounting allegations of hazing within Northwestern University's football program,0,0,0,690,[],[],[],https://pbs.twimg.com/profile_images/378800000510981514/be8eeb758d87d80685fe498fc30c95f7_x96.jpeg,https://twitter.com/stlouisbiz/status/1684277723525521409,tweet_id:1684277723525521409
theater of dreams usher,@sugarfreeprimoz,2023-07-26T19:01:06.000Z,False,Good thing Northwestern University has never had a football scandal. https://twitter.com/_MLFootball/status/1684256790903390214…,0,0,1,163,[],[],[],https://pbs.twimg.com/profile_images/1695563640940765185/P59YcmqA_x96.jpg,https://twitter.com/sugarfreeprimoz/status/1684277683130073088,tweet_id:1684277683130073088
Anti Adult Grooming,@CAAGed,2023-07-26T18:54:44.000Z,False,"4 more Northwestern football alums underwent 'ritualized sexual' hazing, they say https://nbcnews.com/news/us-news/4-northwestern-football-alum-come-forward-hazing-abuse-allegations-rcna95085… via ",0,1,0,66,[],['@nbcnews'],[],https://pbs.twimg.com/profile_images/1276812967569436672/fGAeC0pE_x96.jpg,https://twitter.com/CAAGed/status/1684276079442247680,tweet_id:1684276079442247680
Knox News,@knoxnews,2023-07-26T18:53:02.000Z,False,"What Peter Skoronski said about Northwestern football hazing allegations, Pat Fitzgerald firing",0,0,0,1.1K,[],[],[],https://pbs.twimg.com/profile_images/930525198994067457/Ogqa3kZH_x96.jpg,https://twitter.com/knoxnews/status/1684275653334425602,tweet_id:1684275653334425602
Ben Jones,@Ben_Jones88,2023-07-26T18:50:43.000Z,True,As an aside - Northwestern's student paper uncovering the depth of the football hazing issue really highlights the odd relationship of institutions funding student papers so ostensibly those papers end up being better at uncovering more problems for the institutions to deal with,4,3,33,11K,[],[],[],https://pbs.twimg.com/profile_images/1704150577750421504/D8EVaEvf_x96.jpg,https://twitter.com/Ben_Jones88/status/1684275069575389185,tweet_id:1684275069575389185
Gabe Nadolski,@nadolski_factor,2023-07-26T18:49:15.000Z,True,"Is college football having a reckoning with Hazing? First Northwestern now Minnesota, wonder if there are more to come ",0,0,1,156,[],[],['\\U0001f914'],https://pbs.twimg.com/profile_images/1391581982338043905/ydECHjxC_x96.jpg,https://twitter.com/nadolski_factor/status/1684274699365236737,tweet_id:1684274699365236737
College Football On ClutchPoints,@ClutchPointsCFB,2023-07-26T18:46:16.000Z,False,"David Braun, the Northwestern football interim coach who replaced Pat Fitzgerald, broke his silence on the hazing scandal and delivered a strong message about the upcoming season.",0,0,0,108,[],[],[],https://pbs.twimg.com/profile_images/1322301345408274432/Io9z6phh_x96.jpg,https://twitter.com/ClutchPointsCFB/status/1684273950266884096,tweet_id:1684273950266884096
The Athletic,@TheAthletic,2023-07-26T18:36:49.000Z,True,"Athletic director Derrick Gragg said “there’s no place for hazing” at Northwestern amid the fallout over allegations of hazing within the football program.

""There’s no place for that. There’s no place for hazing. There’s no place for misconduct.""https://theathletic.com/4723432/2023/07/26/derrick-gragg-northwestern-hazing/?source=twitterhq…",0,1,11,24K,[],[],[],https://pbs.twimg.com/profile_images/1710392781502599168/30B7uQGJ_x96.jpg,https://twitter.com/TheAthletic/status/1684271572687757312,tweet_id:1684271572687757312
The Leaf-Chronicle,@LeafChronicle,2023-07-26T18:17:03.000Z,False,"What Peter Skoronski said about Northwestern football hazing allegations, Pat Fitzgerald firing",0,0,0,176,[],[],[],https://pbs.twimg.com/profile_images/988804598394707968/5Lm01AHZ_x96.jpg,https://twitter.com/LeafChronicle/status/1684266598444548097,tweet_id:1684266598444548097
The Daily Herald,@thedailyherald,2023-07-26T18:17:03.000Z,False,"What Peter Skoronski said about Northwestern football hazing allegations, Pat Fitzgerald firing",0,0,0,169,[],[],[],https://pbs.twimg.com/profile_images/1047957325766713346/3VFKCZ7i_x96.jpg,https://twitter.com/thedailyherald/status/1684266595219021826,tweet_id:1684266595219021826
tnsports,@tnsports,2023-07-26T18:02:03.000Z,False,"What Peter Skoronski said about Northwestern football hazing allegations, Pat Fitzgerald firing",0,1,0,502,[],[],[],https://pbs.twimg.com/profile_images/857239484164952064/Y4rmyglJ_x96.jpg,https://twitter.com/tnsports/status/1684262820173447178,tweet_id:1684262820173447178
Richard W. Painter,@RWPUSA,2023-07-26T18:01:03.000Z,False,"This is nowhere near as bad as the sexual assault scandal with Northwestern football, but ⁦⁩ needs to give its program a thorough review. As ⁦⁩ points out a “culture of noncompliance” has been pervasive.",18,13,27,15K,[],"['@UMNews', '@mdhhsu']",[],https://pbs.twimg.com/profile_images/1003038380081467402/02nmFF-X_x96.jpg,https://twitter.com/RWPUSA/status/1684262569458925582,tweet_id:1684262569458925582
Basketball Shoe guide,@shoe_basketball,2023-07-26T18:00:40.000Z,False,Northwestern interim coach David Braun doesn’t address hazing allegations against football programhttps://getlatestnews.site/northwestern-interim-coach-david-braun-doesnt-address-hazing-allegations-against-football-program/?feed_id=8492&_unique_id=64c15f48729e5…,0,0,0,62,[],[],[],https://pbs.twimg.com/profile_images/1614257911848484868/8p34bvgA_x96.png,https://twitter.com/shoe_basketball/status/1684262474776989697,tweet_id:1684262474776989697
Greg Arias,@GregAriasSports,2023-07-26T17:39:56.000Z,False,#Titans rookie Peter Skoronski talked about the Northwestern football hazing issues on Wednesday following practice.,0,0,0,316,['#Titans'],[],[],https://pbs.twimg.com/profile_images/1061753846047916032/1wkQT3sk_x96.jpg,https://twitter.com/GregAriasSports/status/1684257257381298177,tweet_id:1684257257381298177
Harry,@Harry48299960,2023-07-26T17:36:05.000Z,False,Northwestern interim head coach David Braun declines to discuss football coaches’ alleged role in hazing,0,0,0,70,[],[],[],https://pbs.twimg.com/profile_images/1579570458755637248/psDmtZsM_x96.jpg,https://twitter.com/Harry48299960/status/1684256287515901952,tweet_id:1684256287515901952
Daniel Shirley,@DM_Shirley,2023-07-26T17:20:00.000Z,False,Northwestern interim head coach David Braun declines to discuss football coaches’ alleged role in hazing,0,0,0,289,[],[],[],https://pbs.twimg.com/profile_images/1686025492862791680/JJR0TSSO_x96.jpg,https://twitter.com/DM_Shirley/status/1684252238611623938,tweet_id:1684252238611623938
9OYS Sports,@9OYSSports,2023-07-26T17:18:28.000Z,False,Northwestern’s hazing scandal already has cost the university its winningest football coach and a once-pristine reputation.,0,0,0,47,[],[],[],https://pbs.twimg.com/profile_images/1447707348177403904/p8Up9dkm_x96.jpg,https://twitter.com/9OYSSports/status/1684251854501187584,tweet_id:1684251854501187584
The Athletic,@TheAthletic,2023-07-26T16:49:34.000Z,True,"Northwestern interim head coach David Braun declined to discuss allegations of football coaches’ involvement in team hazing traditions.

""I fully trust our university is going through a process and will make decisions based on the facts.""",2,3,5,19K,[],[],[],https://pbs.twimg.com/profile_images/1710392781502599168/30B7uQGJ_x96.jpg,https://twitter.com/TheAthletic/status/1684244582760951820,tweet_id:1684244582760951820
Peddy Tendergrass,@mybad5141,2023-07-26T16:31:04.000Z,False,I would love to see the new black media put more focus on the Northwestern football racist hazing scandal   ,0,0,0,69,[],"['@tariqnasheed', '@TheBlackChannel', '@ProfBlacktruth']",[],https://pbs.twimg.com/profile_images/1750157611151036416/R3j-QRgf_x96.jpg,https://twitter.com/mybad5141/status/1684239923371704320,tweet_id:1684239923371704320
The Athletic,@TheAthletic,2023-07-26T16:14:50.000Z,True,"Big Ten commissioner Tony Petitti said the conference will defer to Northwestern’s two external reviews of the athletic program before the league takes action.

The investigations came in the wake of allegations of hazing in the school’s football program.",2,5,4,25K,[],[],[],https://pbs.twimg.com/profile_images/1710392781502599168/30B7uQGJ_x96.jpg,https://twitter.com/TheAthletic/status/1684235841772703746,tweet_id:1684235841772703746
Kalyn Kahler,@kalynkahler,2023-07-26T16:08:52.000Z,False,"Based off of that David Braun speech, Northwestern is already turning the hazing allegations into a classic football story of overcoming adversity... even though this is a self-inflicted adversity",16,25,100,45K,[],[],[],https://pbs.twimg.com/profile_images/1313518411411083266/BLxcQ1ZU_x96.jpg,https://twitter.com/kalynkahler/status/1684234337582022657,tweet_id:1684234337582022657
Richard E Banks,@rebatty,2023-07-26T15:56:09.000Z,False,New lawsuit provides most detailed account to date of alleged Northwestern football hazing https://usatoday.com/story/sports/ncaaf/bigten/2023/07/24/northwestern-football-hazing-lloyd-yates-lawsuit-details-ben-crump/70454975007/… via ,0,0,1,60,[],['@usatoday'],[],https://pbs.twimg.com/profile_images/101049655/closeup-reb_x96.jpg,https://twitter.com/rebatty/status/1684231137290231809,tweet_id:1684231137290231809
Larry Hawley,@HawleySports,2023-07-26T15:52:41.000Z,False,"Northwestern interim football coach David Braun is talking now at Big Ten Media Day in Indy.
.
He is the first member of the program or administrator in athletics, university to talk on camera in a news conference since the hazing scandal broke nearly 3 weeks ago. ",0,3,1,1.4K,[],['@WGNNews'],[],https://pbs.twimg.com/profile_images/1428461464461971461/P-RRJFzr_x96.jpg,https://twitter.com/HawleySports/status/1684230266628325378,tweet_id:1684230266628325378
93.7 The Ticket,@937TheTicket,2023-07-26T14:42:59.000Z,False,. gives his SFW comments to   &  on the Northwestern Football hazing situation.,0,1,6,1.2K,[],"['@HowardGriffith', '@AhmanGreen30', '@Farleynebraska', '@clairvoyant_mr']",[],https://pbs.twimg.com/profile_images/1548061565156409345/AljvrIk4_x96.jpg,https://twitter.com/937TheTicket/status/1684212726820745222,tweet_id:1684212726820745222
42 daily sports,@HsbZero,2023-07-26T10:56:36.000Z,False,Lloyd Yates' mom slams Northwestern football for 'sickening hazing and trauma'#NorthwesternFootballhttps://tinyurl.com/2b2cdk88,0,0,0,83,['#NorthwesternFootball'],[],[],https://pbs.twimg.com/profile_images/1602697260869062657/4VFApagB_x96.jpg,https://twitter.com/HsbZero/status/1684155752536227840,tweet_id:1684155752536227840
Derek Lawrence,@DerekLawNHI,2023-07-26T10:05:03.000Z,False,Northwestern football players to skip Big Ten Media Days amid hazing scandal fallout #IndianapolisIN #USANews #NewsUpdate #BreakingNews [Video] http://dlvr.it/SslSFd,0,0,0,63,"['#IndianapolisIN', '#USANews', '#NewsUpdate', '#BreakingNews']",[],[],https://pbs.twimg.com/profile_images/1671362606295289857/09scLKh2_x96.jpg,https://twitter.com/DerekLawNHI/status/1684142780640301056,tweet_id:1684142780640301056
Adrian Holman,@ahol888,2023-07-26T09:06:21.000Z,False,2023 Big Ten Media Days:  Northwestern football players choose not to attend amid hazing scandal fallout https://cbssports.com/college-football/news/2023-big-ten-media-days-northwestern-football-players-choose-not-to-attend-amid-hazing-scandal-fallout/… #NU #Big10 #NoCats,0,0,0,73,"['#NU', '#Big10', '#NoCats']",[],[],https://pbs.twimg.com/profile_images/260183041/scan0001_x96.jpg,https://twitter.com/ahol888/status/1684128007118544896,tweet_id:1684128007118544896
Brandon Thompson,@brandonpromo,2023-07-26T08:48:11.000Z,True,Northwestern football players to skip Big Ten Media Days amid hazing scandal fallout #news #breaking #fox http://dlvr.it/SslHHV,0,0,0,65,"['#news', '#breaking', '#fox']",[],[],https://pbs.twimg.com/profile_images/1735197719075921920/Rc0sHnk-_x96.jpg,https://twitter.com/brandonpromo/status/1684123436011126784,tweet_id:1684123436011126784
Four Year Starter,@FourYearStarter,2023-07-26T08:10:09.000Z,False,"BREAKING NEWS Northwestern football players take a stand against hazing scandal, opting out of Big Ten Media Days. Respect for prioritizing integrity and putting their team first! #NorthwesternFootball #IntegrityMatters #TeamFirst",0,0,0,46,"['#NorthwesternFootball', '#IntegrityMatters', '#TeamFirst']",[],"['\\U0001f6a8', '\\U0001f6a8']",https://pbs.twimg.com/profile_images/1653576840714305537/SJ0AAwZq_x96.png,https://twitter.com/FourYearStarter/status/1684113864873459713,tweet_id:1684113864873459713
Susan Henderson,@SusanHe02044156,2023-07-26T08:09:59.000Z,False,Northwestern football players to skip Big Ten Media Days amid hazing scandal fallout,0,0,0,38,[],[],[],https://pbs.twimg.com/profile_images/1526894638073888768/ROK4ZWsu_x96.jpg,https://twitter.com/SusanHe02044156/status/1684113821953056826,tweet_id:1684113821953056826
Berkley Bear,@BerkleyBearNews,2023-07-26T08:08:15.000Z,False,Northwestern football players to skip Big Ten Media Days amid hazing scandal fallout #news #topstories #worldnews,0,0,0,35,"['#news', '#topstories', '#worldnews']",[],[],https://pbs.twimg.com/profile_images/815120203910619136/v7esRsxV_x96.jpg,https://twitter.com/BerkleyBearNews/status/1684113385586319360,tweet_id:1684113385586319360
Rejoice Magazine,@RejoiceMagNews,2023-07-26T07:37:24.000Z,False,Northwestern football players to skip Big Ten Media Days amid hazing scandal fallout http://dlvr.it/Ssl7LT,0,0,0,41,[],[],[],https://pbs.twimg.com/profile_images/552214986681221121/aEONYwJk_x96.jpeg,https://twitter.com/RejoiceMagNews/status/1684105622630047744,tweet_id:1684105622630047744
Fox 40 News,@Fox40News,2023-07-26T06:41:02.000Z,False,Northwestern football players to skip Big Ten Media Days amid hazing scandal fallout https://fox40jackson.com/headlines/northwestern-football-players-to-skip-big-ten-media-days-amid-hazing-scandal-fallout/?utm_source=rss&utm_medium=rss&utm_campaign=northwestern-football-players-to-skip-big-ten-media-days-amid-hazing-scandal-fallout&utm_campaign=snd-autopilot…,0,0,0,147,[],[],[],https://pbs.twimg.com/profile_images/1617917128509722624/q-SSBvZI_x96.jpg,https://twitter.com/Fox40News/status/1684091438483509250,tweet_id:1684091438483509250
Lala Hill,@CeeCee43210,2023-07-26T06:02:20.000Z,False,New lawsuit provides most detailed account to date of alleged Northwestern football hazing - USA TODAY,0,0,0,16,[],[],[],https://pbs.twimg.com/profile_images/1676284260829765640/s9ZblqnV_x96.jpg,https://twitter.com/CeeCee43210/status/1684081697447460866,tweet_id:1684081697447460866
